id,company,created_at
753591,医療法人誠心会前原やすしクリニック,2024-10-01 01:11:48 +0900
753592,医療法人厚生会介護老人保健施設エスポワール立神,2024-10-01 01:11:48 +0900
753601,医療法人尚愛会西田橋小田原病院,2024-10-01 01:11:48 +0900
753608,医療法人誠心会有料老人ホームやぼのさと,2024-10-01 01:11:48 +0900
753614,医療法人参篤会高原ナーシングホーム,2024-10-01 01:11:48 +0900
753629,医療法人裕智会グループホームアルプスの風,2024-10-01 01:11:48 +0900
753635,医療法人博悠会博悠会温泉病院,2024-10-01 01:11:48 +0900
753639,医療法人龍美会介護老人保健施設風花苑,2024-10-01 01:11:48 +0900
753644,医療法人左右会介護医療院とうご,2024-10-01 01:11:48 +0900
753647,医療法人南洲会南洲整形外科病院,2024-10-01 01:11:48 +0900
753648,医療法人慈風会介護老人保健施設鴨池慈風苑デ...,2024-10-01 01:11:48 +0900
753657,医療法人敬天会介護付有料老人ホームけやき,2024-10-01 01:11:48 +0900
753659,医療法人永光会介護老人保健施設寿芳苑,2024-10-01 01:11:48 +0900
753676,医療法人聖心会複合型施設まごころ照国,2024-10-01 01:11:48 +0900
753677,医療法人陽善会光山ホーム,2024-10-01 01:11:48 +0900
753681,医療法人厚生会エスポワール立神,2024-10-01 01:11:48 +0900
753690,医療法人恵愛会サービス付高齢者向け住宅グレースガ...,2024-10-01 01:11:48 +0900
753700,医療法人誠心会グループホームあったかハウス伊集院,2024-10-01 01:11:48 +0900
753701,医療法人浩然会ヴァンベールみどりの風,2024-10-01 01:11:48 +0900
753704,医療法人誠心会グループホームやぼのさと,2024-10-01 01:11:48 +0900
753709,医療法人敬天会グループホームいしき,2024-10-01 01:11:48 +0900
753710,医療法人聖仁会指宿温泉ケアサポート,2024-10-01 01:11:48 +0900
753714,医療法人仁愛会グループホーム笑憩の里,2024-10-01 01:11:48 +0900
753715,医療法人碩済会吉田記念病院,2024-10-01 01:11:48 +0900
753730,医療法人聖仁会南薩ケアほすぴたる,2024-10-01 01:11:48 +0900
753732,医療法人春風会グループホームはるかぜ西陵,2024-10-01 01:11:48 +0900
753737,医療法人碩済会吉田記念病院介護医療院,2024-10-01 01:11:48 +0900
753739,医療法人碩済会加治木記念病院,2024-10-01 01:11:48 +0900
753743,医療法人裕智会グループホームアルプス,2024-10-01 01:11:48 +0900
753759,医療法人佑志会守屋病院通所リハビリテーション,2024-10-01 01:11:48 +0900
753767,医療法人誠心会グループホームあったかハウス串木野,2024-10-01 01:11:48 +0900
753773,医療法人杏政会あじさい苑,2024-10-01 01:11:48 +0900
753777,医療法人菊野会老人保健施設かわなべ寿光苑,2024-10-01 01:11:48 +0900
753787,医療法人尚愛会介護付有料老人ホーム悠楽館,2024-10-01 01:11:48 +0900
753789,医療法人春風会介護付有料老人ホームクレセール天...,2024-10-01 01:11:48 +0900
753792,医療法人仁愛会仁愛会病院,2024-10-01 01:11:48 +0900
753804,医療法人松城会介護老人保健施設希望の里,2024-10-01 01:11:48 +0900
753809,医療法人尚愛会西田橋介護医療院,2024-10-01 01:11:48 +0900
753816,医療法人社団春陽会グループホーム春光苑,2024-10-01 01:11:48 +0900
753844,医療法人楽山会小規模多機能型居宅介護晴れ晴れホ...,2024-10-01 01:11:48 +0900
753849,医療法人誠心会グループホームあったかハウス東市来,2024-10-01 01:11:48 +0900
753854,医療法人明輝会小規模多機能ホームすばる,2024-10-01 01:11:48 +0900
753855,医療法人親貴会グループホームもぜ,2024-10-01 01:11:48 +0900
753875,医療法人玉水会老人保健施設スイートケアなかよし,2024-10-01 01:11:48 +0900
753880,医療法人みゆき会みゆきクリニック通所リハビリテ...,2024-10-01 01:11:48 +0900
753884,医療法人春風会グループホーム明和の家,2024-10-01 01:11:48 +0900
753898,医療法人春風会グループホームはるかぜ,2024-10-01 01:11:48 +0900
753915,医療法人明輝会小規模多機能ホームひばり,2024-10-01 01:11:48 +0900
753918,医療法人誠心会グループホームあったかハウス市来,2024-10-01 01:11:48 +0900
753919,医療法人誠心会グループホームあったかハウス郡山,2024-10-01 01:11:48 +0900
753937,医療法人仁風会介護老人保健施設西千石通所リハビ...,2024-10-01 01:11:48 +0900
753938,医療法人明輝会グループホームよしの村,2024-10-01 01:11:48 +0900
753957,医療法人共助会三州病院,2024-10-01 01:11:48 +0900
753961,医療法人誠心会介護老人保健施設シルバーセンター光...,2024-10-01 01:11:48 +0900
753976,医療法人親貴会グループホームてね,2024-10-01 01:11:48 +0900
753986,医療法人参篤会介護老人保健施設高原ナーシングホ...,2024-10-01 01:11:48 +0900
753999,医療法人春風会グループホームはるかぜ西伊敷,2024-10-01 01:11:48 +0900
754000,医療法人誠心会グループホーム百美,2024-10-01 01:11:48 +0900
754008,医療法人吉祥会吉井整形外科内科中央病院,2024-10-01 01:11:48 +0900
754010,医療法人厚生会グループホーム宝寿庵,2024-10-01 01:11:48 +0900
754026,医療法人徳洲会生見クリニック,2024-10-01 01:11:49 +0900
754040,医療法人聖仁会介護老人保健施設指宿温泉ケアサ...,2024-10-01 01:11:49 +0900
754054,医療法人博悠会グループホームエデンの丘,2024-10-01 01:11:49 +0900
754064,医療法人寛容会グループホーム癒しの森,2024-10-01 01:11:49 +0900
754079,医療法人松寿会介護老人保健施設好日苑,2024-10-01 01:11:49 +0900
754084,医療法人社団若宮会山口若宮病院介護医療院,2024-10-01 01:11:49 +0900
754085,医療法人愛命会介護老人保健施設しまた川苑,2024-10-01 01:11:49 +0900
754086,医療法人博愛会介護老人保健施設寿光園,2024-10-01 01:11:49 +0900
754087,医療法人社団青寿会たけひさ介護医療院,2024-10-01 01:11:49 +0900
754090,医療法人社団成蹊会老人保健施設サンライズ21,2024-10-01 01:11:49 +0900
754091,医療法人和同会老人保健施設宇部幸楽苑,2024-10-01 01:11:49 +0900
754094,医療法人生山会たわらやま介護医療院,2024-10-01 01:11:49 +0900
754104,医療法人協愛会老人保健施設ニューライフあじす,2024-10-01 01:11:49 +0900
754111,医療法人社団生和会グループホーム和み潮音,2024-10-01 01:11:49 +0900
754116,医療法人新生会老人保健施設桜の園,2024-10-01 01:11:49 +0900
754123,医療法人和同会介護老人保健施設防府幸楽苑,2024-10-01 01:11:49 +0900
754132,医療法人新生会小規模多機能型居宅介護ラ・スリーズ,2024-10-01 01:11:49 +0900
754134,医療法人社団まりふ会老人保健施設ふれんず,2024-10-01 01:11:49 +0900
754145,医療法人和同会際波あかり苑,2024-10-01 01:11:49 +0900
754146,医療法人康淳会ナーシングホーム緑町,2024-10-01 01:11:49 +0900
754148,医療法人社団青藍会ハートホーム山口,2024-10-01 01:11:49 +0900
754155,医療法人和同会山口幸楽苑,2024-10-01 01:11:49 +0900
754203,医療法人健仁会グループホーム花,2024-10-01 01:11:49 +0900
754209,医療法人周友会サービス付き高齢者向け住宅さくら,2024-10-01 01:11:49 +0900
754224,医療法人社団福寿会はまゆう重度認知症患者デイケア,2024-10-01 01:11:49 +0900
754226,医療法人松栄会介護老人保健施設あおぞら,2024-10-01 01:11:49 +0900
754232,医療法人実昌会メディカルケア付き高齢者向け住宅プ...,2024-10-01 01:11:49 +0900
754239,医療法人博愛会介護老人保健施設ペあれんと,2024-10-01 01:11:49 +0900
754241,医療法人社団泉仁会介護老人保健施設豊生苑,2024-10-01 01:11:49 +0900
754243,医療法人社団泉仁会宇部第一病院,2024-10-01 01:11:49 +0900
754250,医療法人健仁会介護老人保健施設あさ紫苑,2024-10-01 01:11:49 +0900
754295,医療法人おかはら会おげんきハグ二ティ,2024-10-01 01:11:49 +0900
754317,医療法人和同会山口リハビリテーション病院・山口...,2024-10-01 01:11:49 +0900
754322,医療法人健仁会グループホーム野の花,2024-10-01 01:11:49 +0900
754325,医療法人健仁会通所リハビリテーション寝たろう温泉,2024-10-01 01:11:49 +0900
754327,医療法人睦会介護老人保健施設ナイスケアまほろば,2024-10-01 01:11:49 +0900
754346,医療法人新生会小規模多機能型居宅介護さくら庵,2024-10-01 01:11:49 +0900
754358,医療法人元洋会森山病院,2024-10-01 01:11:49 +0900
754363,医療法人緑山会周南高原病院,2024-10-01 01:11:49 +0900
754366,医療法人松栄会介護老人保健施設まつかぜ,2024-10-01 01:11:49 +0900
754405,医療法人社団長明会長沢病院,2024-10-01 01:11:49 +0900
754439,医療法人新生会小規模多機能型居宅介護ラ・スリ...,2024-10-01 01:11:49 +0900
754450,医療法人松栄会介護老人保健施設なでしこ,2024-10-01 01:11:49 +0900
754466,医療法人松栄会特別養護老人ホーム松風苑,2024-10-01 01:11:49 +0900
754475,医療法人社団水生会住宅型有料老人ホームReL...,2024-10-01 01:11:49 +0900
754484,医療法人和同会山口リハビリテーション病院,2024-10-01 01:11:49 +0900
754490,医療法人茜会脳神経筋センターよしみず病院,2024-10-01 01:11:49 +0900
755624,医療法人社団緑愛会楓の家,2024-10-08 01:39:40 +0900
755771,医療法人有恒会こだまホスピタル,2024-10-08 01:39:41 +0900
756713,久納公認会計士事務所,2024-10-08 12:21:38 +0900
757782,医療法人みらい会介護老人保健施設のぞみ,2024-10-08 23:20:19 +0900
757803,医療法人吉祥会吉田クリニック,2024-10-08 23:20:19 +0900
757815,医療法人杏林会北上駅前病院リハビリパーク北上,2024-10-08 23:20:19 +0900
757817,医療法人杏林会北上駅前病院,2024-10-08 23:20:19 +0900
757844,医療法人共生会松園第一病院,2024-10-08 23:20:19 +0900
757903,医療法人社団葵会介護老人保健施設葵の園・足利,2024-10-08 23:20:20 +0900
757907,医療法人北斗会宇都宮介護医療院,2024-10-08 23:20:20 +0900
757959,医療法人社団全仁会介護老人保健施設ホスピア宇...,2024-10-08 23:20:20 +0900
758054,医療法人社団聖嶺会介護老人保健施設シルバービィ...,2024-10-08 23:20:20 +0900
758060,医療法人慈厚会介護老人保健施設いっせい,2024-10-08 23:20:20 +0900
758073,医療法人社団宗仁会介護老人保健施設サンライフ宗...,2024-10-08 23:20:20 +0900
758119,医療法人社団愛友会勝田病院,2024-10-08 23:20:20 +0900
758124,医療法人聖和会ホワイトハウス千代田,2024-10-08 23:20:20 +0900
758129,医療法人社団青燈会小豆畑病院,2024-10-08 23:20:20 +0900
758157,医療法人社団みなみつくば会サンシャインヴィラ守...,2024-10-08 23:20:20 +0900
758175,医療法人社団醫光会介護老人保健施設まなびの苑,2024-10-08 23:20:20 +0900
758257,医療法人社団醫光会介護老人保健施設ケアピース,2024-10-08 23:20:20 +0900
758273,医療法人社団醫光会介護老人保健施設ケアピース...,2024-10-08 23:20:20 +0900
758275,医療法人六花会介護老人保健施設すみれの里,2024-10-08 23:20:20 +0900
758291,医療法人社団ほたか会介護老人保健施設武尊荘,2024-10-08 23:20:20 +0900
758330,医療法人中沢会萬葉の杜,2024-10-08 23:20:20 +0900
758336,医療法人社団和宏会敬愛病院,2024-10-08 23:20:20 +0900
758373,医療法人杏林会イーハトーブ介護リハビリセンター,2024-10-08 23:20:20 +0900
758907,医療法人社団口福会福田歯科クリニック,2024-10-08 23:38:32 +0900
758913,医療法人社団青嵐会ごとう歯科・矯正歯科クリニック,2024-10-08 23:38:32 +0900
758918,医療法人健歯会五十嵐歯科医院,2024-10-08 23:38:32 +0900
760272,医療法人社団葵会介護老人保健施設葵の園・新潟...,2024-10-08 23:38:33 +0900
760410,医療法人社団白美会介護老人保健施設さくら苑,2024-10-08 23:38:34 +0900
760808,医療法人新光会伊豆平和病院,2024-10-08 23:38:35 +0900
760843,医療法人杏林会介護老人保健施設リハビリパーク清水,2024-10-08 23:38:35 +0900
760920,医療法人社団新和会レッツリハビリデイサービス...,2024-10-08 23:38:35 +0900
761072,医療法人和光会小規模多機能型居宅介護ファミリ...,2024-10-09 23:41:10 +0900
761132,医療法人社団誠広会介護老人保健施設岐阜リハビリ...,2024-10-09 23:41:10 +0900
761166,医療法人友愛会住宅型有料老人ホーム聖人の家風の...,2024-10-09 23:46:26 +0900
761386,医療法人社団幸紀会介護老人保健施設グリーンビ...,2024-10-09 23:46:26 +0900
761700,医療法人キラキラ会キラキラの町,2024-10-09 23:46:26 +0900
761703,医療法人泉壽会加納老健,2024-10-09 23:46:26 +0900
761705,医療法人千寿会介護老人保健施設アルマ千寿,2024-10-09 23:46:26 +0900
761742,医療法人社団茜会介護老人保健施設ディーパあかね,2024-10-09 23:46:27 +0900
761915,医療法人やわらぎ会ゆうゆうの郷,2024-10-09 23:55:56 +0900
761921,医療法人青心会介護付有料老人ホーム青藍の郷,2024-10-09 23:55:56 +0900
761927,医療法人清和会グループ介護老人保健施設サンラ...,2024-10-09 23:55:56 +0900
761934,医療法人青心会介護老人保健施設ピュアネス藍,2024-10-09 23:55:56 +0900
761969,医療法人愛晋会介護老人保健施設エスポワール,2024-10-09 23:55:56 +0900
761974,医療法人愛晋会特定施設入居者生活介護あい向,2024-10-09 23:55:56 +0900
761977,医療法人愛晋会介護付き有料老人ホームあい向,2024-10-09 23:55:56 +0900
762059,医療法人社団創生会アネシス西宮,2024-10-10 00:01:24 +0900
762095,医療法人社団南野会介護老人保健施設南野の郷,2024-10-10 00:01:25 +0900
762382,医療法人佳生会介護老人保健施設セントクリストフ...,2024-10-10 00:01:25 +0900
762569,医療法人尚和会介護老人保健施設ケアヴィラ伊丹,2024-10-10 00:01:25 +0900
762598,医療法人社団創生会グループホームアルテ石屋川,2024-10-10 00:01:25 +0900
762626,医療法人社団紀洋会介護老人保健施設咲楽荘,2024-10-10 00:01:25 +0900
762679,医療法人宮城会居宅介護支援センターみやぎ,2024-10-10 00:01:25 +0900
762680,医療法人康仁会西の京病院,2024-10-10 00:01:25 +0900
762701,医療法人和幸会介護老人保健施設パークヒルズ田原苑,2024-10-10 00:01:25 +0900
762759,医療法人悠明会／ウェルケア悠,2024-10-10 00:01:25 +0900
762786,医療法人やわらぎ会介護老人保健施設悠々の郷,2024-10-10 00:01:26 +0900
762846,医療法人雄信会／介護保険施設大和三山,2024-10-10 00:01:26 +0900
762848,医療法人中川会介護老人保健施設萩の里あすか,2024-10-10 00:01:26 +0900
762874,医療法人仁誠会住宅型有料老人ホームエリシオン奈良,2024-10-10 00:01:26 +0900
762890,医療法人清和会介護老人保健施設サンライフ奈良...,2024-10-10 00:01:26 +0900
762918,医療法人社団松下会介護老人保健施設グランファミリア,2024-10-10 00:01:26 +0900
762956,医療法人宝山会桜の里デイケア,2024-10-10 00:01:26 +0900
762969,医療法人あすか会アンジェロ三碓の里,2024-10-10 00:01:26 +0900
763000,医療法人南風会介護老人保健施設万葉テラス,2024-10-10 00:01:26 +0900
763054,医療法人健和会介護老人保健施設ならふくじゅ荘,2024-10-10 00:01:26 +0900
763058,医療法人玄竜会介護老人保健施設自彊館,2024-10-10 00:01:26 +0900
763061,医療法人愛晋会老人保健施設エスポワール,2024-10-10 00:01:26 +0900
763063,医療法人曙会介護老人保健施設和歌川苑,2024-10-10 00:01:26 +0900
763095,医療法人弘仁会介護医療院ふじの郷,2024-10-10 00:01:26 +0900
763146,医療法人敬英会介護老人保健施設グリーンガーデ...,2024-10-10 00:01:26 +0900
763158,医療法人慈愛会サニー倶楽部,2024-10-10 00:01:26 +0900
763173,医療法人弘仁会瀬藤病院,2024-10-10 00:11:31 +0900
763178,医療法人愛晋会サービス付き高齢者向け住宅あい...,2024-10-10 00:11:31 +0900
763193,医療法人さくら会さくらクリニック,2024-10-10 00:11:31 +0900
763307,医療法人健佑会介護老人保健施設けんゆう苑,2024-10-10 00:16:39 +0900
763423,医療法人友仁会介護老人保健施設アロフェンテ彦根,2024-10-10 00:16:39 +0900
763633,医療法人藤樹会滋賀里病院,2024-10-10 00:16:40 +0900
763690,医療法人和同会グリーンヒル病院,2024-10-10 00:16:40 +0900
764094,医療法人社団あと会介護老人保健施設ふかわ・くに...,2024-10-10 00:16:40 +0900
764096,医療法人和同会広島パークヒル病院,2024-10-10 00:16:40 +0900
764153,医療法人社団葵会介護老人保健施設葵の園・広島,2024-10-10 00:16:40 +0900
764157,医療法人水清会介護医療院みずいちリハビリ苑,2024-10-10 00:16:40 +0900
764425,医療法人知誠会介護老人保健施設アルテピアせと,2024-10-10 00:16:41 +0900
764540,医療法人社団酉仁会浦屋医院,2024-10-10 17:00:43 +0900
764567,医療法人社団医王会住宅型有料老人ホーム健生館け...,2024-10-10 17:00:44 +0900
764568,医療法人弘恵会介護老人保健施設アルテンハイムヨ...,2024-10-10 17:00:44 +0900
764573,医療法人福寿会介護老人保健施設ハッピーランド,2024-10-10 17:00:44 +0900
764585,医療法人正周会介護老人保健施設シルバーケア若園,2024-10-10 17:00:44 +0900
764596,医療法人明寿会介護老人保健施設明寿苑,2024-10-10 17:00:44 +0900
764599,医療法人三井会グループホームくましろ,2024-10-10 17:00:44 +0900
764616,医療法人健明会介護老人保健施設青風苑,2024-10-10 17:00:44 +0900
764626,医療法人社団桜会介護老人保健施設さくら苑,2024-10-10 17:00:44 +0900
764651,医療法人相生会介護老人保健施設光,2024-10-10 17:00:44 +0900
764655,医療法人三芳会介護老人保健施設グリーン・ヒル若松,2024-10-10 17:00:44 +0900
764657,医療法人社団翠会介護老人保健施設ナーシングセンタ...,2024-10-10 17:00:44 +0900
764661,医療法人正弘会老人保健施設湯乃里まとば,2024-10-10 17:00:44 +0900
764703,医療法人正弘会介護老人保健施設湯の里まとば,2024-10-10 17:00:44 +0900
764717,医療法人医和基会介護老人保健施設牧山いわき苑,2024-10-10 17:00:44 +0900
764748,医療法人社団天翠会高野みどりの里グループホーム,2024-10-10 17:00:44 +0900
764781,医療法人社団親和会介護老人保健施設コスモス苑,2024-10-10 17:00:44 +0900
764801,医療法人永寿会シーサイド病院,2024-10-10 17:00:44 +0900
764811,医療法人社団医王会朝倉健生病院通所リハビリテ...,2024-10-10 17:00:44 +0900
764832,医療法人輝松会介護老人保健施設松寿苑,2024-10-10 17:00:44 +0900
764854,医療法人雅紀会グループホームさくら,2024-10-10 17:00:44 +0900
764862,医療法人財団博愛会老健センターささおか,2024-10-10 17:00:44 +0900
764866,医療法人つくし会病院介護老人保健施設はなつくし,2024-10-10 17:00:44 +0900
764870,医療法人社団直心会老人保健施設サンシルバー直方,2024-10-10 17:00:44 +0900
764880,医療法人八女発心会介護老人保健施設舞風台,2024-10-10 17:00:44 +0900
764942,医療法人おくら会介護老人保健施設リゾートヒルや...,2024-10-10 17:06:04 +0900
764945,医療法人厚愛会居宅介護支援事業所クララ,2024-10-10 17:06:04 +0900
764995,医療法人須崎会高陵病院,2024-10-10 17:06:04 +0900
765230,医療法人杏風会老人保健施設セントラルケアホーム,2024-10-10 17:06:05 +0900
765236,医療法人仁勇会居宅介護支援事業所アップル,2024-10-10 17:06:05 +0900
765286,医療法人北辰会介護老人保健施設まなべ,2024-10-10 17:06:05 +0900
765324,医療法人北辰会西条市民病院,2024-10-10 17:06:05 +0900
765498,医療法人光風会介護医療院エバーグリーン,2024-10-10 17:06:05 +0900
765514,医療法人光佑会老人保健施設菜の花,2024-10-10 17:06:05 +0900
765525,医療法人弘仁会共立病院,2024-10-10 17:06:05 +0900
765579,医療法人禅思会久留米南病院通所リハビリテーシ...,2024-10-10 17:06:05 +0900
765588,医療法人柏愛会デイサービス柏の木,2024-10-10 17:06:05 +0900
765592,医療法人八十八会グループホームこすもす,2024-10-10 17:06:05 +0900
765597,医療法人八女発心会有料老人ホーム歌楽楽,2024-10-10 17:06:05 +0900
765615,医療法人柳育会グリーンビュー希望ケ丘,2024-10-10 17:06:05 +0900
765638,医療法人成康会介護老人保健施設博慈苑,2024-10-10 17:06:05 +0900
765646,医療法人社団久英会介護老人保健施設久英荘,2024-10-10 17:06:05 +0900
765647,医療法人八十八会グループホームこすもすⅡ,2024-10-10 17:06:05 +0900
765679,医療法人社団親和会グループホームつつじの丘,2024-10-10 17:06:05 +0900
765698,医療法人社団緑風会水戸病院グループホーム水戸,2024-10-10 17:06:05 +0900
765706,医療法人恵和会慈恵苑,2024-10-10 17:06:05 +0900
765730,医療法人広正会廣澤医院グリーンライフ,2024-10-10 17:06:05 +0900
765748,医療法人相生会新吉塚病院,2024-10-10 17:06:05 +0900
765761,医療法人康和会柴田えみこ在宅ケアプランセンター,2024-10-10 17:06:05 +0900
765781,医療法人晃輝会グループホームふき,2024-10-10 17:06:05 +0900
765904,医療法人睦会介護老人保健施設ナイスケアまほろば,2024-10-10 17:32:58 +0900
765911,医療法人松寿会介護老人保健施設好日苑,2024-10-10 17:32:58 +0900
765914,医療法人新生会老人保健施設桜の園,2024-10-10 17:32:58 +0900
765916,医療法人社団成蹊会老人保健施設サンライズ21,2024-10-10 17:32:58 +0900
765919,医療法人博愛会介護老人保健施設寿光園,2024-10-10 17:32:58 +0900
765932,医療法人松栄会介護老人保健施設なでしこ,2024-10-10 17:32:58 +0900
765950,医療法人松栄会特別養護老人ホーム松風苑,2024-10-10 17:32:58 +0900
765968,医療法人和同会山口リハビリテーション病院・山口...,2024-10-10 17:32:58 +0900
765983,医療法人社団青寿会たけひさ介護医療院,2024-10-10 17:32:58 +0900
765984,医療法人社団まりふ会老人保健施設ふれんず,2024-10-10 17:32:58 +0900
765990,医療法人新生会小規模多機能型居宅介護ラ・スリ...,2024-10-10 17:32:58 +0900
766007,医療法人松栄会介護老人保健施設あおぞら,2024-10-10 17:32:58 +0900
766055,医療法人徳寿会鴨島病院,2024-10-10 17:32:58 +0900
766141,医療法人たくふう会グループホーム八幡の里,2024-10-10 17:38:00 +0900
766182,医療法人たくふう会グループホーム津島の里,2024-10-10 17:38:00 +0900
766289,医療法人昌生会新田外科胃腸科病院,2024-10-10 17:38:00 +0900
766295,医療法人専仁会介護老人保健施設ハワイ信生苑,2024-10-10 17:38:00 +0900
766296,医療法人社団昌平会大山リハビリテーション病院,2024-10-10 17:38:00 +0900
766298,医療法人養和会養和病院,2024-10-10 17:38:00 +0900
766586,医療法人全生会周防病院,2024-10-10 17:38:00 +0900
766609,医療法人社団青寿会武久病院,2024-10-10 17:38:00 +0900
766635,医療法人社団青寿会介護老人保健施設青海荘,2024-10-10 17:38:00 +0900
766671,医療法人社団敬寿会所沢白翔会病院,2024-10-10 17:38:00 +0900
766685,医療法人玖玉会玖珂中央病院,2024-10-10 17:38:00 +0900
766846,医療法人社団青冥会認知症高齢者グループホーム...,2024-10-10 17:38:01 +0900
766892,医療法人社団光風会三光病院,2024-10-10 17:38:01 +0900
767027,医療法人悠穣会サービス付き高齢者向け住宅福有え...,2024-10-10 17:38:01 +0900
767061,医療法人翠松会岩城クリニック,2024-10-10 17:38:01 +0900
767063,医療法人雙立会碩心館病院,2024-10-10 17:38:01 +0900
767075,医療法人社団長久会介護老人保健施設加賀のぞみ園,2024-10-10 19:40:41 +0900
767386,医療法人社団茜会有料老人ホーム吾亦紅,2024-10-10 19:40:41 +0900
767395,医療法人社団茜会グループホームあかねの里,2024-10-10 19:40:41 +0900
767476,医療法人やわらぎ会ゆうゆうの郷,2024-10-10 19:40:41 +0900
767508,医療法人青心会介護付有料老人ホーム青藍の郷,2024-10-10 19:40:41 +0900
767536,医療法人青心会介護老人保健施設ピュアネス藍,2024-10-10 19:40:41 +0900
767545,医療法人清和会介護老人保健施設サンライフ奈良...,2024-10-10 19:40:41 +0900
767546,医療法人和幸会介護老人保健施設パークヒルズ田原苑,2024-10-10 19:40:41 +0900
767547,医療法人宝山会桜の里デイケア,2024-10-10 19:40:41 +0900
767549,医療法人康仁会西の京病院,2024-10-10 19:40:41 +0900
767578,医療法人南風会介護老人保健施設そよ風荘,2024-10-10 19:40:41 +0900
767592,医療法人仁誠会住宅型有料老人ホームエリシオン奈良,2024-10-10 19:40:41 +0900
767597,医療法人悠明会／ウェルケア悠,2024-10-10 19:40:41 +0900
