id,company,created_at
830636,医療法人社団愛敬会介護老人保健施設山咲苑,2024-12-02 00:33:21 +0900
830641,医療法人豊和会介護老人保健施設志摩豊和苑,2024-12-02 00:33:21 +0900
830652,医療法人豊和会デイサービスセンターあらしま,2024-12-02 00:33:21 +0900
830653,医療法人豊和会デイサービスセンター豊和,2024-12-02 00:33:21 +0900
830687,医療法人全心会伊勢メディケアセンターひかりの橋,2024-12-02 00:33:22 +0900
830693,医療法人誠仁会介護付有料老人ホームメディカルヴ...,2024-12-02 00:33:22 +0900
830722,医療法人普照会ビオトープさくら介護老人保健施設,2024-12-02 00:33:22 +0900
830743,医療法人普照会わんがん,2024-12-02 00:33:22 +0900
830815,医療法人豊和会介護老人保健施設鳥羽豊和苑,2024-12-02 00:33:22 +0900
830851,医療法人全心会ひかりの橋デイサービスセンター,2024-12-02 00:33:22 +0900
830860,医療法人碧会なごみの里デイケアセンター,2024-12-02 00:33:22 +0900
830864,医療法人豊和会介護付有料老人ホームふれあいの森,2024-12-02 00:33:22 +0900
830898,医療法人凰林会さくら苑,2024-12-02 00:33:22 +0900
830946,医療法人碧会しおりの里グループホーム,2024-12-02 00:33:22 +0900
830977,医療法人豊和会グループホームあらしま,2024-12-02 00:33:22 +0900
830995,医療法人白鳳会介護老人保健施設鈴の丘,2024-12-02 00:33:22 +0900
831017,医療法人松徳会グループ,2024-12-02 00:33:22 +0900
831020,医療法人普照会老健きそさき,2024-12-02 00:33:22 +0900
831274,医療法人杏林会介護老人保健施設リハビリパーク清水,2024-12-02 01:24:49 +0900
831374,医療法人大和会日下病院,2024-12-02 01:28:05 +0900
831382,医療法人財団青木会青木記念病院,2024-12-02 01:28:05 +0900
831462,医療法人社団綾和会掛川北病院,2024-12-02 01:28:05 +0900
831529,医療法人社団光久会介護老人保健施設はるのケア...,2024-12-02 01:28:05 +0900
831542,医療法人社団あおば会介護老人保健施設あおばケア...,2024-12-02 01:28:05 +0900
831580,医療法人社団喜生会介護老人保健施設新富士ケアセ...,2024-12-02 01:28:05 +0900
831603,医療法人社団鵬友会介護老人保健施設リバブルケア,2024-12-02 01:28:05 +0900
831620,医療法人社団藤友五幸会介護老人保健施設おおふ...,2024-12-02 01:28:05 +0900
831653,医療法人社団藤友五幸会介護老人保健施設おおふじ...,2024-12-02 01:28:05 +0900
831655,医療法人沖縄徳洲会介護老人保健施設あじさい,2024-12-02 01:28:05 +0900
831745,医療法人社団清秀会介護老人保健施設ケア・センタ...,2024-12-02 01:28:05 +0900
831764,医療法人社団聡誠会介護老人保健施設博寿園,2024-12-02 01:28:05 +0900
831813,医療法人社団光久会居宅介護支援すみれ,2024-12-02 01:28:05 +0900
831816,医療法人社団川口会介護老人保健施設エバーグリー...,2024-12-02 01:28:05 +0900
831825,医療法人啓仁会介護老人保健施設いとうの杜,2024-12-02 01:28:05 +0900
831839,医療法人杏林会介護老人保健施設リハビリパーク清水,2024-12-02 01:28:05 +0900
833868,税理士法人川崎会計事務所,2024-12-02 17:54:15 +0900
835160,平山会計事務所,2024-12-02 18:23:14 +0900
835280,アップ会計事務所,2024-12-02 18:23:14 +0900
835819,医療法人財団明理会山形ロイヤル病院,2024-12-03 12:51:56 +0900
835822,医療法人社団さつき会グループホーム明日葉,2024-12-03 12:51:56 +0900
835826,医療法人東北医療福祉会フラワー吉原,2024-12-03 12:51:56 +0900
835865,医療法人尚真会たんのクリニック小規模多機能型居宅...,2024-12-03 12:51:56 +0900
835880,医療法人杏林会介護老人保健施設リハビリパーク...,2024-12-03 12:51:56 +0900
835882,医療法人社団健育会ひまわり在宅サポートグループ,2024-12-03 12:51:56 +0900
835889,医療法人仁泉会介護老人保健施設なとり,2024-12-03 12:51:56 +0900
835907,医療法人社団清山会杜の家いちい,2024-12-03 12:51:56 +0900
835936,医療法人社団葵会介護老人保健施設葵の園・仙台東,2024-12-03 12:51:56 +0900
835941,医療法人社団晃和会グループホームリアスの杜,2024-12-03 12:51:56 +0900
835954,医療法人社団清風会介護老人保健施設清風,2024-12-03 12:51:57 +0900
835961,医療法人ひろせ会広瀬病院,2024-12-03 12:51:57 +0900
836011,医療法人社団公済会介護老人保健施設いたむろ,2024-12-03 12:51:57 +0900
836048,医療法人社団友志会介護老人保健施設ひまわり荘,2024-12-03 12:51:57 +0900
836073,医療法人徳真会介護老人保健施設わたのみ荘,2024-12-03 12:51:57 +0900
836075,医療法人光風会介護老人保健施設晃南,2024-12-03 12:51:57 +0900
836083,医療法人北斗会グループホーム宇都宮,2024-12-03 12:51:57 +0900
836095,医療法人晴生会介護老人保健施設葵の園・水戸中央,2024-12-03 12:51:57 +0900
836101,医療法人重陽会介護老人保健施設なでしこ,2024-12-03 12:51:57 +0900
836121,医療法人慈厚会介護老人保健施設えがお,2024-12-03 12:51:57 +0900
836138,医療法人社団広文会介護老人保健施設いなしきの郷,2024-12-03 12:51:57 +0900
836158,医療法人社団相川会介護老人保健施設つねずみ,2024-12-03 12:51:57 +0900
836160,医療法人社団土合会介護老人保健施設シオン,2024-12-03 12:51:57 +0900
836161,医療法人楽生会介護老人保健施設きねぶち,2024-12-03 12:51:57 +0900
836176,医療法人慈厚会介護老人保健施設ひかり,2024-12-03 12:51:57 +0900
847076,医療法人社団青冥会さつき荘,2024-12-11 01:36:19 +0900
847149,医療法人社団みどり会サービス付き高齢者向け住宅...,2024-12-11 01:36:19 +0900
847161,医療法人社団仁泉会介護老人保健施設鮎の里,2024-12-11 01:36:19 +0900
847163,医療法人社団ひかり会グループホーム愛寿苑,2024-12-11 01:36:19 +0900
847248,医療法人高樹会ふじた医院デイケア・デイサービ...,2024-12-11 01:36:20 +0900
847261,医療法人社団ひかり会愛寿苑,2024-12-11 01:36:20 +0900
847284,医療法人社団光風会三光病院,2024-12-11 01:36:20 +0900
847351,医療法人社団聖心会阪本病院,2024-12-11 01:36:20 +0900
847364,医療法人社団健愛会ケアサポート空港通り,2024-12-11 01:36:20 +0900
847377,医療法人社団雅友愛会太田病院,2024-12-11 01:36:20 +0900
847380,医療法人社団みどり会介護老人保健施設やすらぎ...,2024-12-11 01:36:20 +0900
847414,医療法人みずほ会介護付有料老人ホームケアビレ...,2024-12-11 01:36:20 +0900
847501,医療法人須崎会高陵病院,2024-12-11 01:36:20 +0900
847518,医療法人厚愛会居宅介護支援事業所クララ,2024-12-11 01:36:20 +0900
847551,医療法人おくら会介護老人保健施設リゾートヒルや...,2024-12-11 01:36:20 +0900
847553,医療法人博愛会デイサービスセンターよこはま,2024-12-11 01:36:20 +0900
847563,医療法人野並会高知病院,2024-12-11 01:36:20 +0900
847625,医療法人社団須崎会高陵病院,2024-12-11 01:36:20 +0900
847642,医療法人大生会伊藤整形外科,2024-12-11 01:36:20 +0900
847751,医療法人社団青冥会さつき荘,2024-12-11 01:38:03 +0900
847824,医療法人社団みどり会サービス付き高齢者向け住宅...,2024-12-11 01:38:03 +0900
847836,医療法人社団仁泉会介護老人保健施設鮎の里,2024-12-11 01:38:03 +0900
847838,医療法人社団ひかり会グループホーム愛寿苑,2024-12-11 01:38:03 +0900
847923,医療法人高樹会ふじた医院デイケア・デイサービ...,2024-12-11 01:38:03 +0900
847936,医療法人社団ひかり会愛寿苑,2024-12-11 01:38:03 +0900
847959,医療法人社団光風会三光病院,2024-12-11 01:38:03 +0900
848026,医療法人社団聖心会阪本病院,2024-12-11 01:38:03 +0900
848039,医療法人社団健愛会ケアサポート空港通り,2024-12-11 01:38:03 +0900
848055,医療法人社団みどり会介護老人保健施設やすらぎ...,2024-12-11 01:38:03 +0900
848089,医療法人みずほ会介護付有料老人ホームケアビレ...,2024-12-11 01:38:03 +0900
848154,医療法人博愛会有料老人ホームロイヤルパレス横浜,2024-12-11 01:38:03 +0900
848158,医療法人みずほ会ケアビレッジあさくら,2024-12-11 01:38:03 +0900
848175,医療法人前田会前田病院,2024-12-11 01:38:03 +0900
848176,医療法人須崎会高陵病院,2024-12-11 01:38:03 +0900
848181,医療法人おくら会芸西病院,2024-12-11 01:38:03 +0900
848193,医療法人厚愛会居宅介護支援事業所クララ,2024-12-11 01:38:03 +0900
848197,医療法人十全会介護老人保健施設レイクビューさめ...,2024-12-11 01:38:03 +0900
848218,医療法人みずほ会介護付有料老人ホームケアビレッ...,2024-12-11 01:38:03 +0900
848226,医療法人おくら会介護老人保健施設リゾートヒルや...,2024-12-11 01:38:03 +0900
848228,医療法人博愛会デイサービスセンターよこはま,2024-12-11 01:38:03 +0900
848238,医療法人野並会高知病院,2024-12-11 01:38:03 +0900
848300,医療法人社団須崎会高陵病院,2024-12-11 01:38:03 +0900
848317,医療法人大生会伊藤整形外科,2024-12-11 01:38:03 +0900
848459,医療法人社団青冥会さつき荘,2024-12-11 01:41:08 +0900
848498,医療法人社団観照会屋島ハーモニーホーム,2024-12-11 01:41:08 +0900
848541,医療法人社団三恵会介護老人保健施設ヴィヴァン,2024-12-11 01:41:08 +0900
848546,医療法人社団みどり会介護老人保健施設やすらぎの森,2024-12-11 01:41:08 +0900
848557,医療法人社団みどり会サービス付き高齢者向け住宅...,2024-12-11 01:41:08 +0900
848571,医療法人社団仁泉会介護老人保健施設鮎の里,2024-12-11 01:41:08 +0900
848576,医療法人社団ひかり会グループホーム愛寿苑,2024-12-11 01:41:08 +0900
848664,医療法人慶昭会おおにし介護医療院,2024-12-11 01:41:08 +0900
848667,医療法人社団愛有会岩崎病院,2024-12-11 01:41:08 +0900
848677,医療法人高樹会ふじた医院デイケア・デイサービ...,2024-12-11 01:41:08 +0900
848694,医療法人社団ひかり会愛寿苑,2024-12-11 01:41:08 +0900
848700,医療法人社団五色会介護老人保健施設五色台,2024-12-11 01:41:08 +0900
848712,医療法人福生会介護老人保健施設明けの星,2024-12-11 01:41:08 +0900
848719,医療法人社団有史会高畠病院,2024-12-11 01:41:08 +0900
848722,医療法人社団光風会三光病院,2024-12-11 01:41:08 +0900
848728,医療法人圭良会いこいの郷,2024-12-11 01:41:08 +0900
848760,医療法人福生会多田羅内科クリニック介護老人保...,2024-12-11 01:41:08 +0900
848780,医療法人高樹会ふじた医院デイサービスセンター,2024-12-11 01:41:08 +0900
848822,医療法人社団康生会高松大林病院,2024-12-11 01:41:09 +0900
848824,医療法人社団青冥会介護老人保健施設さつき荘,2024-12-11 01:41:09 +0900
848829,医療法人社団康生会グループホーム暖暖,2024-12-11 01:41:09 +0900
848833,医療法人社団聖心会阪本病院,2024-12-11 01:41:09 +0900
848848,医療法人和光会高松老人保健施設フローラ,2024-12-11 01:41:09 +0900
848859,医療法人社団健愛会ケアサポート空港通り,2024-12-11 01:41:09 +0900
848865,医療法人社団和広会伊達病院介護医療院,2024-12-11 01:41:09 +0900
848879,医療法人社団雅友愛会太田病院,2024-12-11 01:41:09 +0900
848886,医療法人社団みどり会介護老人保健施設やすらぎ...,2024-12-11 01:41:09 +0900
848913,医療法人高樹会ふじた医院デイサービス,2024-12-11 01:41:09 +0900
848924,医療法人川村会介護老人保健施設アザレア,2024-12-11 01:41:09 +0900
848955,医療法人みずほ会介護付有料老人ホームケアビレ...,2024-12-11 01:41:09 +0900
848988,医療法人木村会木村病院,2024-12-11 01:41:09 +0900
849043,医療法人博愛会有料老人ホームロイヤルパレス横浜,2024-12-11 01:41:09 +0900
849046,医療法人山口会介護老人保健施設こうせい,2024-12-11 01:41:09 +0900
849049,医療法人みずほ会ケアビレッジあさくら,2024-12-11 01:41:09 +0900
849081,医療法人前田会前田病院,2024-12-11 01:41:09 +0900
849085,医療法人須崎会高陵病院,2024-12-11 01:41:09 +0900
849097,医療法人おくら会芸西病院,2024-12-11 01:41:09 +0900
849107,医療法人十全会早明浦病院,2024-12-11 01:41:09 +0900
849120,医療法人地塩会介護老人保健施設夢の里,2024-12-11 01:41:09 +0900
849121,医療法人厚愛会居宅介護支援事業所クララ,2024-12-11 01:41:09 +0900
849126,医療法人十全会介護老人保健施設レイクビューさめ...,2024-12-11 01:41:09 +0900
849136,医療法人仁栄会グループホームやすらぎ,2024-12-11 01:41:09 +0900
849139,医療法人千博会グループホームワルツ,2024-12-11 01:41:09 +0900
849153,医療法人博愛会横浜病院,2024-12-11 01:41:09 +0900
849156,医療法人三和会国吉病院,2024-12-11 01:41:09 +0900
849166,医療法人岩河会介護老人保健施設あじさいの里,2024-12-11 01:41:09 +0900
849173,医療法人新松田会愛宕病院分院,2024-12-11 01:41:09 +0900
849175,医療法人山村会山村病院,2024-12-11 01:41:09 +0900
849176,医療法人みずほ会介護付有料老人ホームケアビレッ...,2024-12-11 01:41:09 +0900
849178,医療法人博信会中ノ橋病院,2024-12-11 01:41:09 +0900
849182,医療法人大和会デイサービス秦いきいき学校,2024-12-11 01:41:09 +0900
849194,医療法人おくら会介護老人保健施設リゾートヒルや...,2024-12-11 01:41:09 +0900
849195,医療法人伊野部会高知整形・脳外科病院,2024-12-11 01:41:09 +0900
849196,医療法人地塩会介護老人保健施設夢の里通所リハビ...,2024-12-11 01:41:09 +0900
849205,医療法人博愛会デイサービスセンターよこはま,2024-12-11 01:41:09 +0900
849226,医療法人野並会高知病院,2024-12-11 01:41:09 +0900
849228,医療法人川村会くぼかわ病院,2024-12-11 01:41:09 +0900
849235,医療法人新松田会愛宕病院,2024-12-11 01:41:09 +0900
849240,医療法人長生会大井田病院,2024-12-11 01:41:09 +0900
849254,医療法人厚愛会高知城東病院,2024-12-11 01:41:09 +0900
849256,医療法人聖真会渭南病院,2024-12-11 01:41:09 +0900
849259,医療法人大和会ヤード,2024-12-11 01:41:09 +0900
849266,医療法人慈光会岡豊病院,2024-12-11 01:41:09 +0900
849271,医療法人五月会老人保健施設暖流,2024-12-11 01:41:09 +0900
849278,医療法人社団和光会木俵病院,2024-12-11 01:41:09 +0900
849295,医療法人臼井会田野病院,2024-12-11 01:41:09 +0900
849309,医療法人仁栄会島津病院,2024-12-11 01:41:09 +0900
849310,医療法人仁新会石川記念病院,2024-12-11 01:41:09 +0900
849320,医療法人社団須崎会高陵病院,2024-12-11 01:41:09 +0900
849345,医療法人大生会伊藤整形外科,2024-12-11 01:41:09 +0900
849350,医療法人公世会野市中央病院,2024-12-11 01:41:09 +0900
849493,医療法人社団青冥会さつき荘,2024-12-11 01:42:05 +0900
849532,医療法人社団観照会屋島ハーモニーホーム,2024-12-11 01:42:05 +0900
849575,医療法人社団三恵会介護老人保健施設ヴィヴァン,2024-12-11 01:42:05 +0900
849580,医療法人社団みどり会介護老人保健施設やすらぎの森,2024-12-11 01:42:05 +0900
849591,医療法人社団みどり会サービス付き高齢者向け住宅...,2024-12-11 01:42:05 +0900
849605,医療法人社団仁泉会介護老人保健施設鮎の里,2024-12-11 01:42:05 +0900
849610,医療法人社団ひかり会グループホーム愛寿苑,2024-12-11 01:42:05 +0900
849698,医療法人慶昭会おおにし介護医療院,2024-12-11 01:42:05 +0900
849701,医療法人社団愛有会岩崎病院,2024-12-11 01:42:05 +0900
849711,医療法人高樹会ふじた医院デイケア・デイサービ...,2024-12-11 01:42:05 +0900
849728,医療法人社団ひかり会愛寿苑,2024-12-11 01:42:05 +0900
849734,医療法人社団五色会介護老人保健施設五色台,2024-12-11 01:42:05 +0900
849746,医療法人福生会介護老人保健施設明けの星,2024-12-11 01:42:05 +0900
849753,医療法人社団有史会高畠病院,2024-12-11 01:42:05 +0900
849756,医療法人社団光風会三光病院,2024-12-11 01:42:05 +0900
849762,医療法人圭良会いこいの郷,2024-12-11 01:42:05 +0900
849794,医療法人福生会多田羅内科クリニック介護老人保...,2024-12-11 01:42:05 +0900
849814,医療法人高樹会ふじた医院デイサービスセンター,2024-12-11 01:42:05 +0900
849856,医療法人社団康生会高松大林病院,2024-12-11 01:42:05 +0900
849858,医療法人社団青冥会介護老人保健施設さつき荘,2024-12-11 01:42:05 +0900
849863,医療法人社団康生会グループホーム暖暖,2024-12-11 01:42:05 +0900
849867,医療法人社団聖心会阪本病院,2024-12-11 01:42:05 +0900
849882,医療法人和光会高松老人保健施設フローラ,2024-12-11 01:42:05 +0900
849893,医療法人社団健愛会ケアサポート空港通り,2024-12-11 01:42:05 +0900
849899,医療法人社団和広会伊達病院介護医療院,2024-12-11 01:42:05 +0900
849913,医療法人社団雅友愛会太田病院,2024-12-11 01:42:05 +0900
849920,医療法人社団みどり会介護老人保健施設やすらぎ...,2024-12-11 01:42:05 +0900
849947,医療法人高樹会ふじた医院デイサービス,2024-12-11 01:42:05 +0900
849958,医療法人川村会介護老人保健施設アザレア,2024-12-11 01:42:05 +0900
849989,医療法人みずほ会介護付有料老人ホームケアビレ...,2024-12-11 01:42:05 +0900
850022,医療法人木村会木村病院,2024-12-11 01:42:05 +0900
850077,医療法人博愛会有料老人ホームロイヤルパレス横浜,2024-12-11 01:42:05 +0900
850080,医療法人山口会介護老人保健施設こうせい,2024-12-11 01:42:05 +0900
850083,医療法人みずほ会ケアビレッジあさくら,2024-12-11 01:42:05 +0900
850115,医療法人前田会前田病院,2024-12-11 01:42:05 +0900
850119,医療法人須崎会高陵病院,2024-12-11 01:42:05 +0900
850131,医療法人おくら会芸西病院,2024-12-11 01:42:05 +0900
850141,医療法人十全会早明浦病院,2024-12-11 01:42:05 +0900
850154,医療法人地塩会介護老人保健施設夢の里,2024-12-11 01:42:05 +0900
850155,医療法人厚愛会居宅介護支援事業所クララ,2024-12-11 01:42:05 +0900
850192,医療法人王慈会おうじクリニック,2024-12-11 02:02:26 +0900
850194,医療法人たくふう会グループホーム八幡の里,2024-12-11 02:02:26 +0900
850269,医療法人和陽会まび記念病院,2024-12-11 02:02:26 +0900
850355,医療法人社団仁寿会介護老人保健施設ゆさか,2024-12-11 02:02:26 +0900
850464,医療法人社団あと会介護老人保健施設ふかわ・くに...,2024-12-11 02:02:27 +0900
850525,医療法人和同会広島パークヒル病院,2024-12-11 02:02:27 +0900
850527,医療法人信愛会デイサービス長楽,2024-12-11 02:02:27 +0900
850626,医療法人社団良友会介護老人保健施設藤崎苑,2024-12-11 02:06:58 +0900
850688,医療法人王慈会おうじクリニック,2024-12-11 02:06:58 +0900
850691,医療法人たくふう会グループホーム八幡の里,2024-12-11 02:06:58 +0900
850760,医療法人蘭和会介護老人保健施設ケアガーデン津山,2024-12-11 02:06:58 +0900
850776,医療法人医清会老人保健施設マスカット苑,2024-12-11 02:06:58 +0900
850803,医療法人よつば会グループホームメディフル藤田,2024-12-11 02:06:58 +0900
850813,医療法人行堂会介護老人保健施設ナーシングホー...,2024-12-11 02:06:58 +0900
850828,医療法人和楽会倉敷あいあいえんデイケアセンター,2024-12-11 02:06:58 +0900
850921,医療法人和陽会まび記念病院,2024-12-11 02:06:58 +0900
850926,医療法人睦会老人保健施設ひかり苑,2024-12-11 02:06:58 +0900
850965,医療法人社団石見会介護療養型老人保健施設いわさき,2024-12-11 02:06:58 +0900
850983,医療法人社団ひがしの会小規模多機能ホームみの...,2024-12-11 02:06:59 +0900
851020,医療法人社団永楽会介護老人保健施設メディケア...,2024-12-11 02:06:59 +0900
851083,医療法人社団中川会介護医療院グリーン三条,2024-12-11 02:06:59 +0900
851108,医療法人社団仁寿会介護老人保健施設ゆさか,2024-12-11 02:06:59 +0900
851137,医療法人明和会老人保健施設あけぼの,2024-12-11 02:06:59 +0900
851180,医療法人恒和会介護老人保健施設牛田バラ苑,2024-12-11 02:06:59 +0900
851292,医療法人明和会介護老人保健施設あけぼの,2024-12-11 02:06:59 +0900
851316,医療法人社団杏愛会高橋医院グループホーム恋の水,2024-12-11 02:06:59 +0900
851344,医療法人社団たつき会菅田医院ケアビレッジたつき,2024-12-11 02:06:59 +0900
851364,医療法人社団あと会介護老人保健施設ふかわ・くに...,2024-12-11 02:06:59 +0900
851388,医療法人信愛会デイサービスとも,2024-12-11 02:06:59 +0900
851443,医療法人社団玉章会すずがみね介護医療院,2024-12-11 02:06:59 +0900
851506,医療法人和同会広島パークヒル病院,2024-12-11 02:06:59 +0900
851509,医療法人信愛会デイサービス長楽,2024-12-11 02:06:59 +0900
851517,医療法人好縁会グループホームふれあい大須,2024-12-11 02:06:59 +0900
851592,医療法人紅萌会介護老人保健施設ビーブルかんなべ,2024-12-11 02:06:59 +0900
851632,医療法人好縁会グループホームふれあい段原山崎,2024-12-11 02:06:59 +0900
851650,医療法人社団うすい会老人保健施設さんさん高陽,2024-12-11 02:06:59 +0900
852198,三聖トラスト会計事務所,2024-12-12 21:20:04 +0900
856326,医療法人社団医聖会サービス付き高齢者向け住宅テ...,2024-12-18 03:01:54 +0900
856565,医療法人美星会小林診療所住宅型有料老人ホーム...,2024-12-18 03:01:54 +0900
856654,医療法人大泉会介護老人保健施設くろいし,2024-12-18 03:01:54 +0900
856908,医療法人仁悠会アル・グラン平野,2024-12-18 03:01:55 +0900
857022,医療法人社団創生会介護老人保健施設アネシス寺...,2024-12-18 03:01:55 +0900
857350,医療法人社団健心会グループ,2024-12-18 03:01:55 +0900
857616,医療法人社団瑞穂会みずほ病院,2024-12-19 04:37:20 +0900
857637,医療法人社団瑞穂会住宅型有料老人ホームみずほ...,2024-12-19 04:37:20 +0900
857649,医療法人社団田谷会サービス付き高齢者向け住宅...,2024-12-19 04:37:20 +0900
857791,医療法人社団仁智会金沢南ケアセンター,2024-12-19 04:40:55 +0900
857804,医療法人社団千木福久会福久ケアセンター,2024-12-19 04:40:55 +0900
857809,医療法人社団瑞穂会みずほ病院,2024-12-19 04:40:55 +0900
857832,医療法人社団長久会加賀のぞみ園通所リハビリテ...,2024-12-19 04:40:55 +0900
857841,医療法人社団丹生会介護老人保健施設まだら園,2024-12-19 04:40:55 +0900
857843,医療法人萌和会通所リハビリテーションケアリス...,2024-12-19 04:40:55 +0900
857849,医療法人社団瑞穂会住宅型有料老人ホームみずほ...,2024-12-19 04:40:55 +0900
857880,医療法人社団佳樹会老人保健福祉施設白鳥苑,2024-12-19 04:40:56 +0900
857886,医療法人社団田谷会サービス付き高齢者向け住宅...,2024-12-19 04:40:56 +0900
857894,医療法人社団白山会居宅支援センター千代野,2024-12-19 04:40:56 +0900
857902,医療法人社団長久会山代デイサービスセンター,2024-12-19 04:40:56 +0900
857918,医療法人財団愛生会浜野デイケア津向,2024-12-19 04:40:56 +0900
857928,医療法人社団長久会高齢者グループホームいこい...,2024-12-19 04:40:56 +0900
857931,医療法人社団さくら会老人保健福祉施設さくら園,2024-12-19 04:40:56 +0900
857934,医療法人萌和会通所介護ケアリス山代,2024-12-19 04:40:56 +0900
857987,医療法人健康会いちご月見の里,2024-12-19 04:40:56 +0900
857990,医療法人雄久会介護老人保健施設ひかりケアホーム,2024-12-19 04:40:56 +0900
857999,医療法人健康会いちごデイセンター福井,2024-12-19 04:40:56 +0900
858013,医療法人保仁会泉ケ丘病院,2024-12-19 04:40:56 +0900
858014,医療法人健康会いちごデイセンターみのり,2024-12-19 04:40:56 +0900
858017,医療法人泉壽会加納病院,2024-12-19 04:40:56 +0900
858020,医療法人積善会猪原病院猪原病院,2024-12-19 04:40:56 +0900
858032,医療法人保仁会介護老人保健施設湯の里ナーシン...,2024-12-19 04:40:56 +0900
858034,医療法人社団泉水会介護療養型老人保健施設さくら,2024-12-19 04:40:56 +0900
858044,医療法人福泉会福井温泉病院,2024-12-19 04:40:56 +0900
858299,医療法人康仁会西の京介護医療院やすらぎ,2024-12-19 04:56:39 +0900
858308,医療法人八甲会潮田病院介護医療院,2024-12-19 04:56:39 +0900
858316,医療法人芙蓉会芙蓉会病院,2024-12-19 04:56:39 +0900
858337,医療法人社団長久会加賀のぞみ園,2024-12-19 04:56:39 +0900
858391,医療法人社団岡田会介護老人保健施設やまのべグリ...,2024-12-19 04:56:39 +0900
858392,医療法人社団松下会介護老人保健施設グランファ...,2024-12-19 04:56:39 +0900
