id,company,created_at
947448,医療法人パテラ会有料老人ホーム花水月,2025-02-19 18:18:15 +0900
947451,医療法人社団敬寿会清流館城東,2025-02-19 18:18:15 +0900
947452,医療法人社団慈瑩会介護療養型老人保健施設幸寿苑,2025-02-19 18:18:15 +0900
947465,医療法人原会高齢者複合施設銘仙の家,2025-02-19 18:18:15 +0900
947474,医療法人社団醫光会介護老人保健施設ケアピース...,2025-02-19 18:18:15 +0900
947504,医療法人社団醫光会介護老人保健施設まなびの苑,2025-02-19 18:18:15 +0900
947570,医療法人中沢会萬葉の杜,2025-02-19 18:18:15 +0900
948009,医療法人みゆき会いいやま介護老人保健施設みゆき,2025-02-19 18:38:48 +0900
948774,医療法人伸裕会渡辺病院,2025-02-20 17:59:37 +0900
948902,医療法人仁泉会グループホームにこにこプラザみさわ,2025-02-20 18:04:35 +0900
949158,医療法人社団十二会ゴリラクリニック,2025-02-20 18:04:35 +0900
949168,医療法人杏仁会サービス付き高齢者向け住宅ひかり,2025-02-20 18:04:35 +0900
949385,医療法人永慈会介護老人保健施設ひたちの森ハピネス,2025-02-20 18:04:35 +0900
949398,医療法人社団白帆会訪問看護ステーションしらほ,2025-02-20 18:04:35 +0900
949496,医療法人晴生会鹿島神宮前病院,2025-02-20 18:14:52 +0900
950155,医療法人社団絆尚会足利おとなこども歯科・矯正歯科,2025-02-20 18:19:52 +0900
950275,医療法人社団日高会日高リハビリテーション病院,2025-02-20 18:19:52 +0900
950333,医療法人日望会みどり病院,2025-02-20 18:19:52 +0900
950337,医療法人社団絆尚会尾島デンタルクリニック,2025-02-20 18:19:52 +0900
950339,医療法人社団絆尚会伊勢崎おとなこども歯科・矯正...,2025-02-20 18:19:52 +0900
950474,医療法人社団昌静会さやま産婦人科,2025-02-20 18:19:52 +0900
950484,医療法人社団鴻愛会こうのす共生病院附属大宮駅前...,2025-02-20 18:19:52 +0900
951654,遠藤社会保険労務士事務所,2025-02-27 20:33:47 +0900
951706,医療法人社団聖礼会アス横浜歯科クリニック,2025-02-27 20:33:47 +0900
952137,社会保険労務士金山経営労務事務所,2025-02-27 20:49:59 +0900
952237,医療法人ヘブロン会大宮中央総合病院,2025-02-27 22:23:25 +0900
952814,医療法人社団豊生会東苗穂病院,2025-02-27 22:28:19 +0900
952825,税理士法人鴻田会計事務所,2025-02-27 22:28:19 +0900
953021,医療法人明和会宮田眼科病院,2025-02-27 22:28:19 +0900
955939,医療法人元山会介護老人保健施設ロングライフ塩尻,2025-03-01 15:24:11 +0900
955993,医療法人恵信会介護老人保健施設恵信塩山ケアセン...,2025-03-01 15:24:11 +0900
956899,医療法人社団醫光会グループホームとんぼ,2025-03-03 18:04:34 +0900
956901,医療法人社団醫光会グループホームうさぎ,2025-03-03 18:04:34 +0900
956903,医療法人社団醫光会グループホームのぞみ,2025-03-03 18:04:34 +0900
956908,医療法人社団醫光会グループホーム野ばら,2025-03-03 18:04:34 +0900
956916,医療法人パテラ会有料老人ホーム花水月,2025-03-03 18:04:34 +0900
956924,医療法人社団醫光会グループホームりんご,2025-03-03 18:04:34 +0900
956982,医療法人弘遠会天竜すずかけ病院,2025-03-03 18:09:18 +0900
957240,医療法人青樹会住宅型有料老人ホームシニア・メゾン...,2025-03-03 18:09:18 +0900
957326,医療法人青樹会住宅型有料老人ホームシニア・メ...,2025-03-03 18:09:19 +0900
957413,医療法人岩下会岩下病院,2025-03-03 20:44:28 +0900
957422,医療法人徳洲会皆野病院,2025-03-03 20:44:28 +0900
957424,医療法人社団ほたか会群馬パース病院,2025-03-03 20:44:28 +0900
957429,医療法人社団葵会介護老人保健施設葵の園・那須...,2025-03-03 20:44:28 +0900
957491,医療法人社団亮仁会介護老人保健施設同仁苑,2025-03-03 20:44:28 +0900
957516,医療法人厚生会介護老人保健施設にしかた,2025-03-03 20:44:28 +0900
957545,医療法人光風会介護老人施設晃南,2025-03-03 20:44:28 +0900
957580,医療法人社団友志会リハビリテーション花の舎病院,2025-03-03 20:44:28 +0900
957623,医療法人北斗会宇都宮介護医療院,2025-03-03 20:44:28 +0900
957625,医療法人光風会光南病院,2025-03-03 20:44:28 +0900
957640,医療法人社団友志会地域密着型総合住宅風わらう舎,2025-03-03 20:44:28 +0900
957690,医療法人光風会サービス付高齢者向け住宅アウス...,2025-03-03 20:44:28 +0900
957714,医療法人社団豊和会グループホームなのはな陽東,2025-03-03 20:44:28 +0900
957726,医療法人西秀会にしまぎ介護医療院,2025-03-03 20:44:28 +0900
957743,医療法人社団青洲会介護老人保健施設さくら,2025-03-03 20:44:28 +0900
957745,医療法人晴生会介護老人保健施設葵の園・神栖,2025-03-03 20:44:28 +0900
957749,医療法人江隆会介護老人保健施設サングリーンやさと,2025-03-03 20:44:28 +0900
957752,医療法人竜仁会介護老人保健施設けやきの郷,2025-03-03 20:44:28 +0900
957769,医療法人渡辺会介護医療院おおあらい,2025-03-03 20:44:28 +0900
957806,医療法人社団青潤会介護老人保健施設しもいち,2025-03-03 20:44:28 +0900
957825,医療法人社団聖嶺会介護老人保健施設シルバービィ...,2025-03-03 20:44:28 +0900
957840,医療法人健甦会小美玉敬愛の杜,2025-03-03 20:44:28 +0900
957845,医療法人社団みなみつくば会介護老人保健施設プレミ...,2025-03-03 20:44:28 +0900
957897,医療法人佳和会サービス付き高齢者向け住宅わきあい...,2025-03-03 20:44:28 +0900
957903,医療法人鳳香会介護老人保健施設大串の里,2025-03-03 20:44:28 +0900
957904,医療法人祥仁会小規模多機能型居宅介護きさらぎ,2025-03-03 20:44:28 +0900
957913,医療法人晴生会介護老人保健施設葵の園・水戸,2025-03-03 20:44:28 +0900
957914,医療法人社団双愛会つくば双愛病院,2025-03-03 20:44:28 +0900
957929,医療法人耕平会スーペリア360通所リハビリテーシ...,2025-03-03 20:44:28 +0900
957962,医療法人聖和会介護老人保健施設ホワイトハウス千...,2025-03-03 20:44:28 +0900
957964,医療法人社団白峰会介護老人保健施設しろかね,2025-03-03 20:44:28 +0900
958039,医療法人群羊会久慈茅根病院,2025-03-03 20:44:28 +0900
958049,医療法人恵仁会グループホームデルフィ,2025-03-03 20:44:28 +0900
958055,医療法人永慈会ひたちの森ガーデン,2025-03-03 20:44:28 +0900
958061,医療法人社団みなみつくば会サンシャイン・ヴィラ守...,2025-03-03 20:44:28 +0900
958187,医療法人社団健康尚仁会飯村医院サービス付き高齢者...,2025-03-03 20:49:19 +0900
958333,医療法人社団医新会縄文の里長瀞倶楽部デイケア,2025-03-03 20:59:32 +0900
958481,医療法人社団葵会介護老人保健施設葵の園・熊谷...,2025-03-03 20:59:32 +0900
958509,医療法人社団友志会デイ・リハビリテーションセンタ...,2025-03-03 20:59:32 +0900
958695,医療法人社団富家会メディカルホーム苗間,2025-03-03 21:04:16 +0900
958735,医療法人社団生彩会加須東病院,2025-03-03 21:04:16 +0900
959570,医療法人社団マリア会聖マリアクリニック本院,2025-03-03 22:30:00 +0900
961255,医療法人社団如水会オリーブ高松メディカルクリニ...,2025-03-03 23:28:03 +0900
961874,医療法人社団誠馨会千葉メディカルセンター,2025-03-04 00:23:56 +0900
962193,医療法人仁雄会穂高病院,2025-03-04 00:28:37 +0900
962194,医療法人健人会那須クリニック関西検診協会,2025-03-04 00:28:37 +0900
962195,医療法人正歯会たまご歯科クリニック,2025-03-04 00:28:37 +0900
962196,医療法人正歯会竹村歯科,2025-03-04 00:28:37 +0900
962754,税理士法人池脇会計事務所,2025-03-04 00:40:07 +0900
964791,医療法人原信会原口病院循環器科内科,2025-03-09 20:00:29 +0900
967489,湘南社会福祉事業協同組合,2025-03-13 23:51:50 +0900
967533,静達会協同組合,2025-03-13 23:51:50 +0900
967908,青森県中小企業経友会事業協同組合,2025-03-14 00:40:09 +0900
968086,二十一世紀会事業協同組合,2025-03-14 00:40:09 +0900
968120,一期一会協同組合,2025-03-14 00:40:09 +0900
968142,豊田協栄会協同組合,2025-03-14 00:40:09 +0900
968184,全国中小企業経友会事業協同組合,2025-03-14 00:43:40 +0900
969840,ぎょれん協同会社事業協同組合,2025-03-14 21:17:34 +0900
970827,一期一会協同組合,2025-03-15 00:00:38 +0900
971181,中部中小企業共栄会協同組合,2025-03-15 00:00:38 +0900
971249,二十一世紀会事業協同組合,2025-03-15 00:00:38 +0900
971353,佐賀経友会事業協同組合,2025-03-15 00:00:38 +0900
971401,全国中小企業経友会事業協同組合,2025-03-15 00:00:38 +0900
971558,医療社会福祉事業協同組合,2025-03-15 00:00:38 +0900
972343,大屋造船協力会協同組合,2025-03-15 00:50:52 +0900
972506,富士経友会協同組合,2025-03-15 00:50:52 +0900
972596,山田建設誠友会事業協同組合,2025-03-15 00:50:52 +0900
972709,広昌会協同組合,2025-03-15 00:50:53 +0900
972886,新潟経成会国際化支援事業協同組合,2025-03-15 12:18:03 +0900
972998,旭会グローバル協同組合,2025-03-15 12:18:03 +0900
973327,東日本中小企業経友会事業協同組合,2025-03-15 12:18:03 +0900
973366,東海国際交友会事業協同組合,2025-03-15 12:18:03 +0900
976667,湘南社会福祉事業協同組合,2025-03-15 23:16:28 +0900
976931,福岡県企業振興会協同組合,2025-03-15 23:16:28 +0900
977085,群馬県中小企業経友会事業協同組合,2025-03-15 23:33:13 +0900
977278,豊田協栄会協同組合,2025-03-15 23:33:13 +0900
977409,関西同友会事業協同組合,2025-03-15 23:33:13 +0900
977410,関西経友会事業協同組合,2025-03-15 23:33:13 +0900
977424,阿波龍昇会協同組合,2025-03-15 23:33:13 +0900
977447,青森県中小企業経友会事業協同組合,2025-03-15 23:33:13 +0900
977458,静岡県経友会事業協同組合,2025-03-15 23:33:13 +0900
977461,静達会協同組合,2025-03-15 23:33:13 +0900
978116,医療法人永慈会介護老人保健施設ひたちの森ハピネス,2025-03-16 00:34:50 +0900
978174,医療法人晴生会介護老人保健施設葵の園・八千代,2025-03-16 00:34:50 +0900
978175,医療法人幕内会介護老人保健施設あいあい,2025-03-16 00:34:50 +0900
978202,医療法人社団慈瑩会介護療養型老人保健施設幸寿苑,2025-03-16 00:34:50 +0900
978234,医療法人上野会介護老人保健施設ナーシングホーム館林,2025-03-16 00:34:50 +0900
978236,医療法人社団醫光会介護老人保健施設まなびの苑,2025-03-16 00:34:50 +0900
978248,医療法人財団明理会仙台ロイヤルケアセンター,2025-03-16 00:38:46 +0900
978287,医療法人杏林会介護老人保健施設リハビリパークあ...,2025-03-16 00:38:46 +0900
978289,医療法人財団明理会介護老人保健施設丸森ロイヤ...,2025-03-16 00:38:46 +0900
978317,医療法人財団明理会介護老人保健施設丸森ロイヤル...,2025-03-16 00:38:46 +0900
978433,医療法人社団喜英会介護老人保健施設加瀬ウェルネ...,2025-03-16 00:38:46 +0900
978539,医療法人秀仁会川島クリニック,2025-03-16 00:38:46 +0900
978587,医療法人美湖会介護老人保健施設ゴーエン美浦,2025-03-16 00:45:00 +0900
978593,医療法人秀仁会介護老人保健施設おはよう館,2025-03-16 00:45:00 +0900
978606,医療法人圭友会介護老人保健施設藍,2025-03-16 00:45:00 +0900
978609,医療法人永慈会介護老人保健施設ひたちの森ハピネス,2025-03-16 00:45:00 +0900
978655,医療法人晴生会介護老人保健施設葵の園・神栖,2025-03-16 00:45:00 +0900
978659,医療法人江隆会介護老人保健施設サングリーンや...,2025-03-16 00:45:00 +0900
978721,医療法人社団三思会グループホームクララ相生,2025-03-16 00:45:00 +0900
978722,医療法人社団三思会グループホームクララトーホー,2025-03-16 00:45:00 +0900
978765,医療法人新瑛会介護医療院ふえき,2025-03-16 00:45:01 +0900
978772,医療法人中沢会介護老人保健施設けやき苑,2025-03-16 00:45:01 +0900
978868,医療法人日望会サービス付き高齢者向け住宅サン...,2025-03-16 00:45:01 +0900
978870,医療法人社団にいさと会介護老人保健施設さくら苑,2025-03-16 00:45:01 +0900
978952,医療法人社団三思会グループホーム部,2025-03-16 00:49:44 +0900
978968,医療法人パテラ会有料老人ホーム花水月,2025-03-16 00:59:03 +0900
979043,医療法人新瑛会介護医療院ふえき,2025-03-16 00:59:03 +0900
979053,医療法人六花会介護老人保健施設すみれの里,2025-03-16 00:59:03 +0900
979087,医療法人瑞穂会介護老人保健施設みさと,2025-03-16 00:59:03 +0900
979116,医療法人社団三思会グループホームクララ相生,2025-03-16 00:59:03 +0900
979122,医療法人社団醫光会介護老人保健施設ケアピース,2025-03-16 00:59:03 +0900
979143,医療法人中沢会介護老人保健施設けやき苑,2025-03-16 00:59:03 +0900
979159,医療法人原会介護老人保健施設まゆ玉,2025-03-16 00:59:03 +0900
979179,医療法人社団にいさと会介護老人保健施設さくら苑,2025-03-16 00:59:03 +0900
979194,医療法人社団岩下会岩下病院グループホームあさがお,2025-03-16 00:59:03 +0900
979232,医療法人社団美心会老健くろさわ,2025-03-16 00:59:03 +0900
979293,医療法人徳洲会皆野病院,2025-03-16 00:59:03 +0900
979338,医療法人社団三思会グループホーム部,2025-03-16 00:59:03 +0900
979378,医療法人一羊会上武呼吸器科内科病院,2025-03-16 00:59:03 +0900
979399,医療法人北斗会宇都宮介護医療院,2025-03-16 00:59:03 +0900
979458,医療法人社団亮仁会介護老人保健施設同仁苑,2025-03-16 00:59:03 +0900
979470,医療法人北斗会介護老人保健施設宇都宮シルバー...,2025-03-16 00:59:03 +0900
979499,医療法人さくら会さくらのクリニック,2025-03-16 00:59:03 +0900
979507,医療法人光風会介護老人施設晃南,2025-03-16 00:59:03 +0900
979508,医療法人北斗会宇都宮東病院,2025-03-16 00:59:03 +0900
979569,医療法人社団友志会リハビリテーション翼の舎病院,2025-03-16 00:59:03 +0900
979574,医療法人社団友志会リハビリテーション花の舎病院,2025-03-16 00:59:04 +0900
979609,医療法人五光会あっとほーむ舟場,2025-03-16 00:59:04 +0900
979621,医療法人社団寿会吉沢病院,2025-03-16 01:03:23 +0900
982159,医療法人社団蔵王会佐藤病院,2025-03-17 23:07:44 +0900
982762,医療法人社団明雄会エスポワールさいたま,2025-03-25 17:34:42 +0900
982767,医療法人社団鴻愛会こうのすナーシングホーム共生園,2025-03-25 17:34:42 +0900
982780,医療法人財団明理会草加ロイヤルケアセンター,2025-03-25 17:34:42 +0900
982788,医療法人社団桐和会川口メディケアセンター,2025-03-25 17:34:42 +0900
982795,医療法人社団愛友会介護老人保健施設一心館,2025-03-25 17:34:42 +0900
982797,医療法人社団武蔵野会グリーンビレッジ朝霞台,2025-03-25 17:34:42 +0900
982835,医療法人徳明会介護老人保健施設飯能リハビリ館,2025-03-25 17:34:42 +0900
982910,医療法人社団全仁会介護老人保健施設ホスピア宇...,2025-03-25 17:34:42 +0900
983113,医療法人互生会とまりや,2025-03-25 17:39:13 +0900
983125,医療法人明吾会介護老人保健施設川越ケアセンター,2025-03-25 17:39:13 +0900
983135,医療法人社団葵会葵の園・春日部,2025-03-25 17:39:13 +0900
983284,医療法人財団弘慈会介護老人保健施設グレイスガ...,2025-03-28 12:19:07 +0900
983296,医療法人財団明理会介護老人保健施設仙台ロイヤ...,2025-03-28 12:19:07 +0900
983333,医療法人耕平会スーペリア360通所リハビリテーシ...,2025-03-28 12:19:07 +0900
983339,医療法人浩成会介護老人保健施設あたごナーシング...,2025-03-28 12:19:07 +0900
983343,医療法人西秀会にしまぎ介護医療院,2025-03-28 12:19:07 +0900
983350,医療法人社団健康尚仁会飯村医院サービス付き高齢者...,2025-03-28 12:19:07 +0900
983351,医療法人健甦会小美玉敬愛の杜,2025-03-28 12:19:07 +0900
983353,医療法人社団みなみつくば会介護老人保健施設プレミ...,2025-03-28 12:19:07 +0900
983371,医療法人博順会博純苑,2025-03-28 12:19:07 +0900
983378,医療法人愛正会田尻ヶ丘病院,2025-03-28 12:19:07 +0900
983440,医療法人杏林会介護老人保健施設リハビリパークみ...,2025-03-28 12:24:26 +0900
983442,医療法人一秀会認知症高齢者グループホーム堤通り,2025-03-28 12:24:26 +0900
983457,医療法人杏林会介護老人保健施設リハビリパークさ...,2025-03-28 12:24:26 +0900
983465,医療法人社団泉翔会介護老人保健施設泉翔の里,2025-03-28 12:24:26 +0900
983504,医療法人社団東北福祉会介護老人保健施設せんだん...,2025-03-28 12:24:26 +0900
983575,医療法人金上仁友会サービス付き高齢者向け住宅け...,2025-03-28 12:24:26 +0900
983765,医療法人社団青燈会小豆畑病院,2025-03-28 17:06:08 +0900
983791,医療法人社団醫光会グループホーム野ばら,2025-03-28 17:06:08 +0900
983798,医療法人社団醫光会グループホームうさぎ,2025-03-28 17:06:08 +0900
983826,医療法人社団醫光会グループホームとんぼ,2025-03-28 17:06:08 +0900
983900,医療法人康生会つつじメンタルホスピタル,2025-03-28 17:06:08 +0900
983922,医療法人岩下会岩下病院,2025-03-28 17:06:08 +0900
984015,医療法人社団全仁会介護老人保健施設ホスピア宇...,2025-03-28 17:06:08 +0900
984020,医療法人厚生会介護老人保健施設にしかた,2025-03-28 17:06:08 +0900
984081,医療法人善心会グループ,2025-03-28 17:10:54 +0900
984084,医療法人徳洲会小規模多機能ケアポプリ,2025-03-28 17:10:54 +0900
984094,医療法人恒信会サービス付き高齢者向け住宅レスピこ...,2025-03-28 17:10:54 +0900
984136,医療法人社団葵会介護老人保健施設葵の園・熊谷,2025-03-28 17:10:54 +0900
984149,医療法人健寿会小山整形外科の郷,2025-03-28 17:10:54 +0900
984263,医療法人むつき会住宅型有料老人ホーム恵,2025-03-29 21:05:12 +0900
984373,医療法人翔洋会介護老人保健施設ヘルスケアホー...,2025-03-29 21:10:44 +0900
984476,医療法人誠励会デイサービスセンターひらた,2025-03-29 21:10:45 +0900
984480,医療法人社団敬愛会福島キャッスル,2025-03-29 21:10:45 +0900
984497,医療法人栄心会ショートステイさかえマイハート希望,2025-03-29 21:10:45 +0900
984571,医療法人愛広会介護付き有料老人ホーム愛広苑壱番館,2025-03-29 21:10:45 +0900
984615,医療法人美郷会ショートステイこころはす亀貝,2025-03-29 21:10:45 +0900
984629,医療法人博優会通所リハビリテーションめぐみ園,2025-03-29 21:10:45 +0900
985261,医療法人社団平成会藤枝平成記念病院,2025-03-29 21:37:53 +0900
985972,医療法人社団政宗会ハート歯科クリニック,2025-03-29 22:01:20 +0900
986031,医療法人泰一会多摩北整形外科病院,2025-03-29 22:01:20 +0900
986040,総務スタッフ／大手法律事務所のグループ会社,2025-03-29 22:01:20 +0900
988894,税理士法人山下会計事務所,2025-03-30 00:56:57 +0900
990434,一般社団法人社会福祉推進機構,2025-03-30 14:59:41 +0900
990476,医療法人社団公済会介護老人保健施設いたむろ,2025-04-02 19:46:50 +0900
990482,医療法人北斗会宇都宮介護医療院,2025-04-02 19:46:50 +0900
990483,医療法人光風会介護老人保健施設晃南,2025-04-02 19:46:50 +0900
990485,医療法人徳真会介護老人保健施設わたのみ荘,2025-04-02 19:46:50 +0900
990493,医療法人社団友志会石橋総合病院,2025-04-02 19:46:50 +0900
990498,医療法人光風会サービス付高齢者向け住宅アウス...,2025-04-02 19:46:50 +0900
990507,医療法人社団春明会介護老人保健施設ちとせ,2025-04-02 19:50:56 +0900
990561,医療法人財団聖蹟会介護老人保健施設ハートラン...,2025-04-02 19:50:56 +0900
990736,医療法人娯生会介護老人保健施設みどうの杜,2025-04-02 19:50:57 +0900
990797,医療法人社団明雄会介護老人保健施設エスポ―ル岩槻,2025-04-02 19:50:57 +0900
990834,医療法人社団明雄会介護老人保健施設エスポワール...,2025-04-02 19:50:57 +0900
990898,医療法人財団聖蹟会​介護老人保健施設ハートラン...,2025-04-02 19:50:57 +0900
990911,医療法人社団明雄会エスポワール所沢,2025-04-02 19:50:57 +0900
990950,医療法人社団協友会ケアセンター八潮,2025-04-02 19:50:57 +0900
990992,医療法人社団白報会入間東幸楽園,2025-04-02 19:50:57 +0900
991090,医療法人徳洲会行田ふれあいクリニック,2025-04-02 19:50:57 +0900
991104,医療法人社団萌彰会リヤンド-絆-那須,2025-04-02 19:50:57 +0900
991135,医療法人桃李会介護老人保健施設ほほえみ,2025-04-02 19:50:57 +0900
991141,医療法人光風会介護付有料老人ホームアスピア乙女,2025-04-02 19:50:57 +0900
991151,医療法人北斗会介護老人保健施設宇都宮シルバーホ...,2025-04-02 19:50:57 +0900
991205,医療法人聖生会介護老人保健施設安純の里,2025-04-02 19:50:57 +0900
991230,医療法人さくら会介護老人保健施設さくら野,2025-04-02 19:50:57 +0900
991231,医療法人社団湘風会小規模多機能型居宅介護施設た...,2025-04-02 19:50:57 +0900
991261,医療法人社団全仁会介護老人保健施設ホスピア宇都宮,2025-04-02 19:50:57 +0900
991281,医療法人社団湘風会小規模多機能型居宅介護施設み...,2025-04-02 19:50:57 +0900
991294,医療法人正美会介護老人保健施設たすけあい,2025-04-02 19:50:57 +0900
991295,医療法人博愛会介護老人保健施設祇園荘,2025-04-02 19:50:57 +0900
991305,医療法人社団湘風会グループホームピオニー,2025-04-02 19:50:57 +0900
991384,医療法人社団竹山会介護老人保健施設いこいの郷,2025-04-02 19:50:57 +0900
991394,医療法人社団城南会介護老人保健施設シルバーケ...,2025-04-02 19:50:57 +0900
991395,医療法人社団松徳会介護老人保健施設もてぎの森...,2025-04-02 19:50:57 +0900
991439,医療法人社団湘風会小規模多機能型居宅介護施設ひ...,2025-04-02 19:50:57 +0900
991455,医療法人大田原厚生会介護老人保健施設椿寿荘,2025-04-02 19:50:57 +0900
991486,医療法人社団湘風会グループホームアベーテ,2025-04-02 19:50:57 +0900
991523,医療法人社団土合会介護老人保健施設シオン,2025-04-02 20:01:42 +0900
991524,医療法人社団健康尚仁会飯村医院サービス付き高齢者...,2025-04-02 20:01:42 +0900
991526,医療法人恵仁会グループホームデルフィ,2025-04-02 20:01:42 +0900
991531,医療法人慈厚会介護老人保健施設ひかり,2025-04-02 20:01:42 +0900
991532,医療法人社団広文会介護老人保健施設いなしきの郷,2025-04-02 20:01:42 +0900
991538,医療法人晴生会鹿島神宮前病院,2025-04-02 20:01:42 +0900
991542,医療法人慈厚会介護老人保健施設えがお,2025-04-02 20:01:42 +0900
991543,医療法人重陽会介護老人保健施設なでしこ,2025-04-02 20:01:42 +0900
991559,医療法人康生会つつじメンタルホスピタル,2025-04-02 20:01:42 +0900
991564,医療法人社団醫光会グループホームとんぼ,2025-04-02 20:01:42 +0900
991573,医療法人社団寿会吉沢病院,2025-04-02 20:01:42 +0900
991575,医療法人社団松嶺会冨士ヶ丘病院,2025-04-02 20:01:42 +0900
991582,医療法人緑陽会介護老人保健施設こまち,2025-04-02 20:01:42 +0900
991628,医療法人慈啓会介護老人保健施設しらさぎ荘,2025-04-02 20:05:49 +0900
991639,医療法人社団湘風会グループホームフロール,2025-04-02 20:05:49 +0900
991657,上都賀厚生農業協同組合連合会老人保健施設かみつが,2025-04-02 20:05:49 +0900
991663,佐野厚生農業協同組合連合会佐野厚生総合病院,2025-04-02 20:05:49 +0900
991666,医療法人社団京愛会黒磯病院,2025-04-02 20:05:49 +0900
991668,医療法人社団隆成会皆川病院,2025-04-02 20:05:49 +0900
991676,医療法人社団いずみ会温泉リハビリテーションいま...,2025-04-02 20:05:49 +0900
991702,医療法人それいゆ会高萩それいゆ病院指定通所リハビ...,2025-04-02 20:05:49 +0900
991717,医療法人社団双愛会介護老人保健施設ひまわり,2025-04-02 20:05:49 +0900
991722,医療法人竜仁会グループホームもみじ館,2025-04-02 20:05:49 +0900
991747,医療法人社団健康尚仁会飯村医院デイサービスなかよし,2025-04-02 20:05:49 +0900
991760,医療法人社団みなみつくば会グループホーム筑水苑,2025-04-02 20:05:49 +0900
991763,医療法人耕平会介護老人保健施設スーペリア360,2025-04-02 20:05:49 +0900
991771,医療法人社団白峰会小規模多機能型居宅介護ザ・クラブ,2025-04-02 20:05:49 +0900
991772,医療法人渡辺会介護老人保健施設おおあらい,2025-04-02 20:05:49 +0900
