id,company,created_at
115600,医療法人社団登豊会近石病院,2021-09-16 09:02:39 +0900
115601,医療法人社団登豊会近石病院,2021-09-16 09:03:42 +0900
172086,静達会協同組合,2022-05-16 20:26:15 +0900
172879,大屋造船協力会協同組合,2022-05-16 20:29:04 +0900
172959,阿波龍昇会協同組合,2022-05-16 20:29:18 +0900
173224,関西同友会事業協同組合,2022-05-16 20:30:05 +0900
173247,旭会グローバル協同組合,2022-05-16 20:30:09 +0900
173262,関西経友会事業協同組合,2022-05-16 20:30:12 +0900
173344,豊田協栄会協同組合,2022-05-16 20:30:41 +0900
173436,愛知県中小企業経友会事業協同組合,2022-05-16 20:30:57 +0900
173479,静岡県経友会事業協同組合,2022-05-16 20:31:04 +0900
173514,東海国際交友会事業協同組合,2022-05-16 20:31:10 +0900
173518,中部中小企業共栄会協同組合,2022-05-16 20:31:11 +0900
173567,二十一世紀会事業協同組合,2022-05-16 20:31:19 +0900
173587,富士経友会協同組合,2022-05-16 20:31:23 +0900
173676,新潟経成会国際化支援事業協同組合,2022-05-16 20:31:38 +0900
173714,山田建設誠友会事業協同組合,2022-05-16 20:31:46 +0900
173745,東京中小企業経友会事業協同組合,2022-05-16 20:31:51 +0900
173935,群馬県中小企業経友会事業協同組合,2022-05-16 20:33:07 +0900
173949,東日本中小企業経友会事業協同組合,2022-05-16 20:33:10 +0900
362729,医療法人翔友会グループホームおり姫,2022-09-14 22:28:54 +0900
362770,医療法人藤枝会介護老人保健施設第Ⅱ四季の里,2022-09-14 22:29:07 +0900
362796,医療法人香徳会関中央病院介護老人保健施設太...,2022-09-14 22:29:16 +0900
362811,医療法人博我会高石病院,2022-09-14 22:29:21 +0900
362847,医療法人達磨会東加古川病院,2022-09-14 22:29:33 +0900
362905,医療法人尚徳会リハビリデイサービスよなは,2022-09-14 22:29:51 +0900
362917,医療法人普照会もりえい病院,2022-09-14 22:29:55 +0900
362960,医療法人東和会小林病院,2022-09-14 22:34:19 +0900
362962,医療法人正雄会呉みどりケ丘病院,2022-09-14 22:34:19 +0900
362963,医療法人微風会ビハーラ花の里病院,2022-09-14 22:34:20 +0900
362966,医療法人社団知仁会(メープルヒル病院)介護職員(入浴介助),2022-09-14 22:34:21 +0900
362971,医療法人好縁会介護付き有料老人ホーム「えにしの里」,2022-09-14 22:34:22 +0900
362975,医療法人社団ひろまさ会ミルキーケア,2022-09-14 22:34:24 +0900
362984,医療法人社団輔仁会太田川病院,2022-09-14 22:34:27 +0900
362985,医療法人社団博愛会木阪病院,2022-09-14 22:34:27 +0900
362987,医療法人社団広島厚生会広島厚生病院,2022-09-14 22:34:28 +0900
362988,医療法人社団貴和会佐伯中央病院,2022-09-14 22:34:28 +0900
362993,医療法人清幸会三原城町病院,2022-09-14 22:34:30 +0900
362999,医療法人社団あえば会デイサービスささゆり,2022-09-14 22:34:31 +0900
363018,医療法人信愛会デイサービス長楽,2022-09-14 22:34:38 +0900
363025,医療法人社団仁寿会介護老人保健施設ゆさか,2022-09-14 22:34:40 +0900
363037,医療法人社団ひがしの会デイサービスセンター多治米,2022-09-14 22:34:44 +0900
363039,医療法人社団初仁会桧田病院,2022-09-14 22:34:45 +0900
363041,医療法人社団葵会AOI広島病院,2022-09-14 22:34:45 +0900
363046,医療法人社団慈恵会いまだ病院,2022-09-14 22:34:47 +0900
363056,医療法人翠和会養神館病院,2022-09-14 22:34:50 +0900
363063,医療法人ながえ会庄原同仁病院,2022-09-14 22:34:52 +0900
363069,医療法人健応会福山リハビリテーション病院,2022-09-14 22:34:54 +0900
363070,医療法人紘友会福山友愛病院,2022-09-14 22:34:55 +0900
363093,医療法人凰林会榊原白鳳病院,2022-09-14 22:35:03 +0900
363095,医療法人大仲会大仲さつき病院,2022-09-14 22:35:03 +0900
363113,医療法人財団百葉の会アルクみずあおい,2022-09-14 22:35:09 +0900
363130,医療法人社団健育会介護老人保健施設しおさい,2022-09-14 22:35:15 +0900
363141,医療法人財団百葉の会グループホームゆひもや,2022-09-14 22:35:18 +0900
366340,みちのく社会福祉協同組合,2022-10-02 15:11:30 +0900
379874,全国中小企業経友会事業協同組合,2022-11-18 17:38:29 +0900
442566,医療法人田中会武蔵ヶ丘病院,2023-06-20 00:41:11 +0900
602024,会津若松卸商団地協同組合,2024-05-18 16:45:47 +0900
632983,奥会津かねやま福業協同組合,2024-05-19 11:41:45 +0900
632986,奥会津地域づくり協同組合,2024-05-19 11:41:46 +0900
632987,会津美里町地域づくり事業協同組合,2024-05-19 11:41:47 +0900
698052,税理士法人竹川会計事務所,2024-08-06 22:31:28 +0900
698054,税理士法人中野会計事務所,2024-08-06 22:31:28 +0900
698055,税理士法人五十嵐会計事務所,2024-08-06 22:31:28 +0900
698059,税理士法人斉藤税務会計事務所,2024-08-06 22:31:28 +0900
698062,税理士法人池脇会計事務所,2024-08-06 22:31:28 +0900
698075,医療法人豊和会新札幌豊和会病院,2024-08-06 22:31:28 +0900
698077,Aimパートナーズ総合会計事務所,2024-08-06 22:31:28 +0900
698098,医療法人社団慈昂会琴似駅前内科クリニック,2024-08-06 22:31:28 +0900
698138,医療法人福和会札幌立花病院,2024-08-06 22:31:29 +0900
698140,医療法人社団静和会平和リハビリテーション病院,2024-08-06 22:31:29 +0900
698160,板垣洋公認会計士事務所,2024-08-06 22:31:29 +0900
698221,医療法人愛全会愛全病院,2024-08-06 22:31:29 +0900
698227,医療法人札幌会岩澤クリニック,2024-08-06 22:31:29 +0900
698239,医療法人社団奏健会さっぽろ厚別通内科,2024-08-06 22:31:29 +0900
698247,医療法人社団弘恵会整形外科内科沢口医院,2024-08-06 22:31:29 +0900
698259,医療法人渓和会江別病院,2024-08-06 22:31:29 +0900
698266,医療法人菊郷会石橋胃腸病院,2024-08-06 22:31:29 +0900
698302,医療法人社団北裕会札幌記念病院,2024-08-06 22:31:30 +0900
698304,医療法人重仁会大谷地病院,2024-08-06 22:31:30 +0900
698307,医療法人社団青優会南小樽病院,2024-08-06 22:31:30 +0900
698316,中井会計事務所,2024-08-06 22:31:30 +0900
698331,医療法人讃生会網走記念病院,2024-08-06 22:31:30 +0900
698345,医療法人北武会美しが丘病院,2024-08-06 22:31:30 +0900
698379,医療法人中山会新札幌パウロ病院,2024-08-06 22:31:30 +0900
698390,医療法人社団積信会三村病院,2024-08-06 22:31:30 +0900
698462,医療法人ヘブロン会大宮中央総合病院,2024-08-06 22:31:30 +0900
698483,医療法人清陵会藤井病院・藤井病院介護医療院,2024-08-06 22:31:30 +0900
698822,医療法人なごみ会山内整形外科,2024-08-06 22:31:32 +0900
698823,医療法人ときわ会ときわ会病院,2024-08-06 22:31:32 +0900
698886,医療法人みらい会介護老人保健施設のぞみ,2024-08-06 22:31:32 +0900
699123,医療法人杏林会北上駅前病院,2024-08-06 22:31:34 +0900
699183,医療法人泰悠会大浦内科・歯科クリニック,2024-08-06 22:31:34 +0900
699184,医療法人杏林会北上駅前病院リハビリパーク北上,2024-08-06 22:31:34 +0900
699186,医療法人杏林会イーハトーブ病院,2024-08-06 22:31:34 +0900
699219,医療法人社団光友会介護老人保健施設アルパイン川崎,2024-08-06 22:31:34 +0900
699278,医療法人社団交鐘会あおぞら在宅診療所仙台中央,2024-08-06 22:31:34 +0900
699283,医療法人徳洲会仙台徳洲会病院,2024-08-06 22:31:34 +0900
699289,医療法人海邦会鹿島記念病院,2024-08-06 22:31:34 +0900
699295,医療法人社団恒心会佐藤医院,2024-08-06 22:31:35 +0900
699297,医療法人香木会伊藤病院,2024-08-06 22:31:35 +0900
699304,税理士法人大藤会計事務所,2024-08-06 22:31:35 +0900
699413,医療法人社団ひかる会あかね歯科,2024-08-06 22:31:35 +0900
699615,医療法人明徳会青葉西デンタルクリニック,2024-08-06 22:31:36 +0900
699640,医療法人報徳会利府デンタルクリニック,2024-08-06 22:31:36 +0900
699649,医療法人社団雅会まさこ歯科クリニック,2024-08-06 22:31:36 +0900
699655,医療法人明徳会青葉デンタルクリニック,2024-08-06 22:31:36 +0900
699807,医療法人仁慈会東台病院,2024-08-06 22:31:37 +0900
699865,医療法人社団楽聖会こころのクリニック山形,2024-08-06 22:31:38 +0900
700030,医療法人健腎会大森中央泌尿器科・内科・外科クリ...,2024-08-06 22:31:38 +0900
700051,医療法人疾風会わかまつインターベンションクリニ...,2024-08-06 22:31:38 +0900
700134,医療法人櫛田会櫛田病院,2024-08-06 22:31:39 +0900
700184,医療法人慈久会谷病院,2024-08-06 22:31:39 +0900
700188,医療法人誠励会ひらた中央病院,2024-08-06 22:31:39 +0900
700338,医療法人秀仁会介護老人保健施設さくら日立,2024-08-06 22:31:40 +0900
700359,医療法人盡誠会宮本病院,2024-08-06 22:31:40 +0900
700503,医療法人社団北水会北水会記念病院,2024-08-06 22:31:41 +0900
700505,医療法人社団尽徳会県西在宅クリニック,2024-08-06 22:31:41 +0900
700514,医療法人晴生会介護老人保健施設葵の園・常総,2024-08-06 22:31:41 +0900
700515,医療法人社団青燈会小豆畑病院,2024-08-06 22:31:41 +0900
700549,医療法人慈政会小柳病院・小柳クリニック,2024-08-06 22:31:41 +0900
700970,税理士法人東京さくら会計事務所,2024-08-06 22:31:43 +0900
701000,増山公認会計士事務所,2024-08-06 22:31:43 +0900
701030,栃木県トラック協会協同組合,2024-08-06 22:31:43 +0900
701057,医療法人慶晴会宇都宮南病院,2024-08-06 22:31:44 +0900
701107,社会保険労務士法人田村社労士事務所,2024-08-06 22:31:44 +0900
701138,医療法人清和会鹿沼病院,2024-08-06 22:31:44 +0900
701221,石山明公認会計士事務所,2024-08-06 22:31:44 +0900
701229,医療法人社団全仁会宇都宮中央病院,2024-08-06 22:31:44 +0900
701375,医療法人杏林会今井病院,2024-08-06 22:31:45 +0900
701410,医療法人社団福田会福田記念病院,2024-08-06 22:31:45 +0900
701427,一般社団法人佐野市医師会附属,2024-08-06 22:31:45 +0900
701437,山田社会保険労務士事務所,2024-08-06 22:31:45 +0900
701460,医療法人社団寿会吉沢病院,2024-08-06 22:31:45 +0900
701493,医療法人望真会古作クリニック玉村分院,2024-08-06 22:31:46 +0900
701513,医療法人社団醫光会赤城クリニック,2024-08-06 22:31:46 +0900
701525,医療法人財団明理会春日部中央総合病院,2024-08-06 22:31:46 +0900
701547,医療法人社団心誠会太田中央眼科,2024-08-06 22:31:46 +0900
701818,医療法人社団敬寿会前橋城南病院,2024-08-06 22:31:47 +0900
701843,医療法人上野会介護老人保健施設ナーシングホーム...,2024-08-06 22:31:47 +0900
701854,税理士法人石田会計事務所,2024-08-06 22:31:47 +0900
702302,医療法人社団悠輝会富山みんなの二口町内科クリニ...,2024-08-06 22:31:50 +0900
702308,税理士法人表会計事務所,2024-08-06 22:31:50 +0900
702317,社会保険労務士山田事務所,2024-08-06 22:31:50 +0900
702345,コステム社会保険労務士事務所,2024-08-06 22:31:50 +0900
702351,税理士法人北陸合同会計事務所,2024-08-06 22:31:50 +0900
702464,医療法人社団和宏会敬愛病院,2024-08-06 22:31:50 +0900
702576,医療法人三精会こころの森病院,2024-08-06 22:31:51 +0900
702619,医療法人健康会いちご訪問看護ステーション,2024-08-06 22:31:51 +0900
702692,矢島会計事務所,2024-08-06 22:31:51 +0900
702717,柴田公認会計士事務所,2024-08-06 22:31:51 +0900
702956,税理士法人TACT高井法博会計事務所,2024-08-06 22:31:52 +0900
702997,医療法人厚生会奈良厚生会病院,2024-08-06 22:31:53 +0900
703022,医療法人社団幸紀会安江病院,2024-08-06 22:31:53 +0900
703028,医療法人社団登豊会近石病院,2024-08-06 22:31:53 +0900
703158,医療法人社団久誠会三浦老人保健施設,2024-08-06 22:31:53 +0900
703175,山城税務会計事務所,2024-08-06 22:31:53 +0900
703212,税理士法人東海浜松会計事務所,2024-08-06 22:31:53 +0900
703213,飯野明宏税理士公認会計士事務所,2024-08-06 22:31:53 +0900
703226,税理士法人伏見会計事務所,2024-08-06 22:31:53 +0900
703245,医療法人社団恵寿会あかばね腎・泌尿器クリニック,2024-08-06 22:31:53 +0900
703260,公益財団法人静岡県予防医学協会静岡事務所,2024-08-06 22:31:54 +0900
703269,医療法人社団健森会あうるクリニック駿河ベイ,2024-08-06 22:31:54 +0900
703271,医療法人社団健森会あうるクリニック富士山,2024-08-06 22:31:54 +0900
703272,医療法人社団健森会あうるクリニック東海,2024-08-06 22:31:54 +0900
703346,医療法人社団ふよう会彦坂歯科医院,2024-08-06 22:31:54 +0900
703424,医療法人社団綾和会浜松南病院,2024-08-06 22:31:54 +0900
703523,医療法人社団澤記念会神経科浜松病院,2024-08-06 22:31:55 +0900
703813,医療法人優心会中橋整形外科クリニック,2024-08-06 22:31:57 +0900
703856,税理士法人吉永会計事務所,2024-08-06 22:31:57 +0900
704042,高田総合会計事務所,2024-08-06 22:31:58 +0900
704118,医療法人社団松仁会内田病院,2024-08-06 22:31:58 +0900
704119,ルート会計事務所,2024-08-06 22:31:58 +0900
704143,医療法人啓信会介護老人保健施設ひしの里,2024-08-06 22:31:58 +0900
704163,医療法人社団恵心会SD美容クリニック,2024-08-06 22:31:58 +0900
704167,医療法人社団幸恩会中尾歯科クリニック,2024-08-06 22:31:58 +0900
704171,医療法人健緑会立石クリニック,2024-08-06 22:31:58 +0900
704177,医療法人社団恵心会京都武田病院,2024-08-06 22:31:58 +0900
704188,医療法人社団育生会京都久野病院,2024-08-06 22:31:58 +0900
704199,医療法人仁心会宇治川病院,2024-08-06 22:31:59 +0900
704201,医療法人社団恵心会祇園町醫院,2024-08-06 22:31:59 +0900
704206,医療法人芳松会田辺病院,2024-08-06 22:31:59 +0900
704207,医療法人愛智会京都北野病院介護医療院,2024-08-06 22:31:59 +0900
704208,医療法人社団蒼樹会山本整形外科,2024-08-06 22:31:59 +0900
704212,医療法人愛厚会一色整形外科医院,2024-08-06 22:31:59 +0900
704218,医療法人博侑会吉岡医院,2024-08-06 22:31:59 +0900
704279,医療法人社団淀さんせん会金井病院,2024-08-06 22:31:59 +0900
704358,医療法人医仁会精華町国民健康保険病院,2024-08-06 22:31:59 +0900
704427,医療法人啓信会京都きづ川病院,2024-08-06 22:31:59 +0900
704432,医療法人社団貴順会吉川病院,2024-08-06 22:32:00 +0900
704529,藤田晃三会計事務所,2024-08-06 22:32:00 +0900
704532,税理士法人水埜会計事務所,2024-08-06 22:32:00 +0900
704537,税理士法人山下会計事務所,2024-08-06 22:32:00 +0900
704550,税理士法人増田会計事務所,2024-08-06 22:32:00 +0900
704566,医療法人社団顕鐘会神戸百年記念病院,2024-08-06 22:32:00 +0900
704572,篠原正裕公認会計士事務所,2024-08-06 22:32:00 +0900
704595,桑の実園福祉会中央事務所,2024-08-06 22:32:00 +0900
704596,竹代会計事務所,2024-08-06 22:32:00 +0900
704603,医療法人社団良清会介護医療院すまいれすと夢野,2024-08-06 22:32:00 +0900
704608,医療法人社団勇往会竹下医院,2024-08-06 22:32:00 +0900
704610,医療法人社団東峰会関西青少年サナトリューム,2024-08-06 22:32:00 +0900
704615,医療法人社団あんしん会あんしん病院,2024-08-06 22:32:00 +0900
704620,医療法人社団和華会よしだ循環器内科クリニック,2024-08-06 22:32:00 +0900
704625,医療法人徳洲会高砂西部病院,2024-08-06 22:32:00 +0900
704626,医療法人社団アガぺ会アガぺ甲山病院,2024-08-06 22:32:00 +0900
704637,医療法人社団菫会北須磨病院,2024-08-06 22:32:00 +0900
704638,医療法人晋真会ベリタス病院,2024-08-06 22:32:00 +0900
704640,医療法人永仁会尼崎永仁会クリニック,2024-08-06 22:32:00 +0900
704643,医療法人社団幸泉会高田上谷病院,2024-08-06 22:32:00 +0900
704649,医療法人社団それいゆ会こだま病院,2024-08-06 22:32:00 +0900
704655,医療法人社団一秀会春日病院,2024-08-06 22:32:00 +0900
704662,医療法人社団薫楓会緑駿病院,2024-08-06 22:32:01 +0900
704668,医療法人社団さくら会高橋病院,2024-08-06 22:32:01 +0900
704676,医療法人社団智聖会安藤病院,2024-08-06 22:32:01 +0900
704733,医療法人社団医水会そらクリニック,2024-08-06 22:32:01 +0900
704741,医療法人社団敬誠会合志病院,2024-08-06 22:32:01 +0900
704744,医療法人博愛会広野高原病院,2024-08-06 22:32:01 +0900
704746,医療法人祐生会祐生病院,2024-08-06 22:32:01 +0900
704748,医療法人社団六心会恒生病院,2024-08-06 22:32:01 +0900
704756,医療法人純徳会田中病院,2024-08-06 22:32:01 +0900
704763,医療法人旭会園田病院,2024-08-06 22:32:01 +0900
704765,医療法人芳恵会三好病院,2024-08-06 22:32:01 +0900
704766,医療法人社団青洲会アイワ病院,2024-08-06 22:32:01 +0900
704767,医療法人社団安真会あんしんクリニック川西,2024-08-06 22:32:01 +0900
704770,医療法人社団朋誠会ゆう透析クリニック,2024-08-06 22:32:01 +0900
704772,ユアブレーン尾上会計事務所,2024-08-06 22:32:01 +0900
704807,医療法人社団つかさ会尾原病院,2024-08-06 22:32:01 +0900
704820,医療法人健和会健和花隈歯科クリニック,2024-08-06 22:32:01 +0900
704831,医療法人社団祐生会祐生病院,2024-08-06 22:32:01 +0900
704988,黒田会計事務所,2024-08-06 22:32:02 +0900
704999,医療法人仁誠会奈良セントラル病院,2024-08-06 22:32:02 +0900
705007,東口会計事務所,2024-08-06 22:32:02 +0900
705016,中井総合会計事務所,2024-08-06 22:32:02 +0900
705018,医療法人優心会吉江医院,2024-08-06 22:32:02 +0900
705032,及川総合会計事務所,2024-08-06 22:32:02 +0900
705034,医療法人新生会高の原中央病院,2024-08-06 22:32:02 +0900
705035,医療法人青心会郡山青藍病院,2024-08-06 22:32:02 +0900
705039,医療法人やわらぎ会やわらぎクリニック,2024-08-06 22:32:02 +0900
705045,医療法人康成会星和台クリニック,2024-08-06 22:32:02 +0900
705048,医療法人果恵会恵王病院,2024-08-06 22:32:02 +0900
705092,医療法人ライブラ会ゆめはんな歯科クリニック高の原,2024-08-06 22:32:02 +0900
705128,医療法人青心会介護付有料老人ホーム青藍の郷,2024-08-06 22:32:02 +0900
705142,医療法人清和会グループ介護老人保健施設サンラ...,2024-08-06 22:32:02 +0900
705149,医療法人健和会奈良東病院,2024-08-06 22:32:02 +0900
705152,医療法人青心会介護老人保健施設ピュアネス藍,2024-08-06 22:32:02 +0900
705177,医療法人やわらぎ会ゆうゆうの郷,2024-08-06 22:32:03 +0900
705297,北畑会計事務所,2024-08-06 22:32:03 +0900
705303,医療法人弘仁会瀬藤病院,2024-08-06 22:32:03 +0900
705311,内藤会計事務所,2024-08-06 22:32:03 +0900
705323,医療法人富田会富田病院,2024-08-06 22:32:03 +0900
705454,医療法人たちばな会西岡病院,2024-08-06 22:32:04 +0900
705485,医療法人さくら会さくらクリニック,2024-08-06 22:32:04 +0900
705525,医療法人弘仁会瀬藤病院／介護医療院ふじの郷,2024-08-06 22:32:04 +0900
705529,医療法人愛晋会特定施設入居者生活介護あい向,2024-08-06 22:32:04 +0900
705530,医療法人愛晋会サービス付き高齢者向け住宅あい...,2024-08-06 22:32:04 +0900
705532,医療法人愛晋会介護付き有料老人ホームあい向,2024-08-06 22:32:04 +0900
705533,医療法人愛晋会介護老人保健施設エスポワール,2024-08-06 22:32:04 +0900
705673,医療法人俊心会なかむら耳鼻咽喉科,2024-08-06 22:32:05 +0900
705675,医療法人紀典会北川病院,2024-08-06 22:32:05 +0900
705678,医療法人勲友会味野医院,2024-08-06 22:32:05 +0900
705679,医療法人洋友会中島病院,2024-08-06 22:32:05 +0900
705689,医療法人医清会山本医院,2024-08-06 22:32:05 +0900
705695,医療法人よつば会よつば会リハビリセンター,2024-08-06 22:32:05 +0900
705696,医療法人岡山奏和会撫川クリニック,2024-08-06 22:32:05 +0900
705700,医療法人天成会青江クリニック,2024-08-06 22:32:05 +0900
705705,医療法人王慈会おうじクリニック,2024-08-06 22:32:05 +0900
705716,医療法人社団仁明会おさふねクリニック,2024-08-06 22:32:05 +0900
705721,医療法人智彰会すこやかこどもクリニック,2024-08-06 22:32:05 +0900
705723,医療法人弘和会みやけ内科小児科医院,2024-08-06 22:32:05 +0900
705724,医療法人たくふう会旭竜クリニック,2024-08-06 22:32:05 +0900
705725,医療法人よつば会にった整形クリニック,2024-08-06 22:32:05 +0900
705728,医療法人よつば会ながい内科クリニック,2024-08-06 22:32:05 +0900
705732,医療法人豊仁会まな星クリニック,2024-08-06 22:32:05 +0900
705733,医療法人進愛会ひがしリハビリテーション・整形ク...,2024-08-06 22:32:05 +0900
705737,医療法人社団恵風会宮本整形外科病院,2024-08-06 22:32:05 +0900
705741,医療法人芥子会城本クリニック,2024-08-06 22:32:05 +0900
705744,医療法人和陽会まび記念病院,2024-08-06 22:32:05 +0900
705747,医療法人福寿会藤戸クリニック,2024-08-06 22:32:05 +0900
705751,医療法人社団造山会まきび病院,2024-08-06 22:32:05 +0900
705768,社会保険労務士法人わかさ合同事務所,2024-08-06 22:32:05 +0900
705955,税理士法人あおぞら会計事務所,2024-08-06 22:32:06 +0900
705956,池永経営会計事務所,2024-08-06 22:32:06 +0900
706031,医療法人慈徳会真田病院,2024-08-06 22:32:06 +0900
706053,公認会計士・税理士日下真吾事務所,2024-08-06 22:32:06 +0900
706101,医療法人永和会下永病院,2024-08-06 22:32:07 +0900
706151,医療法人真慈会真愛病院,2024-08-06 22:32:07 +0900
706297,社会保険労務士FUTAGO事務所,2024-08-06 22:32:08 +0900
706336,医療法人社団陽光会光中央病院,2024-08-06 22:32:08 +0900
706376,医療法人瑛幸会ひで歯科クリニック,2024-08-06 22:32:08 +0900
706401,医療法人平成博愛会徳島平成病院,2024-08-06 22:32:08 +0900
706422,医療法人徳寿会鴨島病院,2024-08-06 22:32:09 +0900
706429,医療法人愛生会兼松病院,2024-08-06 22:32:09 +0900
706454,里坊会計事務所,2024-08-06 22:32:09 +0900
706459,共同会計事務所,2024-08-06 22:32:09 +0900
706482,医療法人福生会多田羅内科クリニック,2024-08-06 22:32:09 +0900
706515,医療法人春風会樫村病院,2024-08-06 22:32:09 +0900
706533,医療法人高樹会ふじた医院,2024-08-06 22:32:09 +0900
706593,医療法人結和会松山西病院,2024-08-06 22:32:09 +0900
706687,医療法人社団酉仁会浦屋医院,2024-08-06 22:32:10 +0900
706744,医療法人財団杏林会東明病院,2024-08-06 22:32:10 +0900
706755,医療法人大生会伊藤整形外科,2024-08-06 22:32:10 +0900
706778,橋本誠公認会計士事務所,2024-08-06 22:32:10 +0900
706855,税理士法人羽生会計事務所,2024-08-06 22:32:11 +0900
706858,伊東会計事務所,2024-08-06 22:32:11 +0900
706859,伊藤会計事務所,2024-08-06 22:32:11 +0900
706860,医療法人社団扶洋会秦病院,2024-08-06 22:32:11 +0900
706865,医療法人鵬志会別府病院,2024-08-06 22:32:11 +0900
706885,医療法人永寿会シーサイド病院,2024-08-06 22:32:11 +0900
706904,医療法人昌和会見立病院,2024-08-06 22:32:11 +0900
706908,川庄公認会計士事務所,2024-08-06 22:32:11 +0900
706912,力丸公認会計士事務所,2024-08-06 22:32:11 +0900
706964,蔵渕公認会計士事務所,2024-08-06 22:32:11 +0900
706965,池田一暁公認会計士事務所,2024-08-06 22:32:11 +0900
707012,税理士法人黒川合同会計事務所,2024-08-06 22:32:11 +0900
707022,医療法人ケンサン会片井整形外科・内科病院,2024-08-06 22:32:12 +0900
707024,医療法人社団正信会水戸病院,2024-08-06 22:32:12 +0900
707026,医療法人社団天翠会吉田みどりの里,2024-08-06 22:32:12 +0900
707314,医療法人社団高邦会福岡山王病院,2024-08-06 22:32:13 +0900
707318,医療法人光煕会明治記念病院,2024-08-06 22:32:13 +0900
707320,医療法人つくし会病院介護老人保健施設はなつくし,2024-08-06 22:32:13 +0900
707321,医療法人光洋会赤間病院,2024-08-06 22:32:13 +0900
707358,税理士法人いまり税務会計事務所,2024-08-06 22:32:13 +0900
707367,医療法人同愛会サンテ溝上病院,2024-08-06 22:32:13 +0900
707388,医療法人博友会堀田病院,2024-08-06 22:32:13 +0900
707483,白石会計事務所,2024-08-06 22:32:14 +0900
707506,医療法人徳志会・みんなの熊本クリニック,2024-08-06 22:32:14 +0900
707510,医療法人清和会老人保健施設シルバーピア水前寺,2024-08-06 22:32:14 +0900
707526,医療法人日隈会日隈病院,2024-08-06 22:32:14 +0900
707587,医療法人末永会すえなが婦人科・産科クリニック,2024-08-06 22:32:14 +0900
707643,清末会計事務所,2024-08-06 22:32:15 +0900
707644,医療法人大晴会べっぷ在宅・訪問クリニック,2024-08-06 22:32:15 +0900
707647,税理士法人大分綜合会計事務所,2024-08-06 22:32:15 +0900
707730,稲倉会計事務所,2024-08-06 22:32:15 +0900
707740,医療法人幸秀会大江整形外科病院,2024-08-06 22:32:15 +0900
